,Actors,Awards,BoxOffice,Country,DVD,Director,Genre,Language,Metascore,Plot,Poster,Production,Rated,Ratings,Released,Response,Runtime,Title,Type,Website,Writer,Year,imdbID,imdbRating,imdbVotes,totalSeasons
435,"Tatsuya Fujiwara, Aki Maeda, Tarô Yamamoto, Takeshi Kitano",7 wins & 8 nominations.,N/A,Japan,20 Mar 2012,Kinji Fukasaku,"Adventure, Drama, Sci-Fi, Thriller",Japanese,81,"In the future, the Japanese government captures a class of ninth-grade students and forces them to kill each other under the revolutionary ""Battle Royale"" act.",https://m.media-amazon.com/images/M/MV5BMTgxMmJhNjItMmFlMS00MWVlLWIyMjktYjUyYTI4MzA0YzgxXkEyXkFqcGdeQXVyNjU0OTQ0OTY@._V1_SX300.jpg,Anchor Bay Entertainment,Not Rated,"[{'Source': 'Internet Movie Database', 'Value': '7.7/10'}, {'Source': 'Rotten Tomatoes', 'Value': '87%'}, {'Source': 'Metacritic', 'Value': '81/100'}]",16 Dec 2000,True,114 min,Battle Royale,movie,N/A,"Koushun Takami (novel), Kenta Fukasaku (screenplay)",2000,tt0266308,7.7,"158,251",
436,"Jung Suh, Yoosuk Kim, Sung-hee Park, Jae-Hyun Cho",5 wins & 2 nominations.,N/A,South Korea,20 May 2003,Ki-duk Kim,"Drama, Thriller",Korean,61,A Carer becomes the mother to a secluded isle.,https://m.media-amazon.com/images/M/MV5BM2NkMjI2ZDctNDdjYy00ZGVkLWExNTQtZWM4MTgxYzAxMDJmXkEyXkFqcGdeQXVyMzM4MjM0Nzg@._V1_SX300.jpg,Myung Film,Not Rated,"[{'Source': 'Internet Movie Database', 'Value': '7.0/10'}, {'Source': 'Rotten Tomatoes', 'Value': '77%'}, {'Source': 'Metacritic', 'Value': '61/100'}]",22 Apr 2000,True,90 min,The Isle,movie,N/A,Ki-duk Kim,2000,tt0255589,7.0,"11,545",
437,"Dan Futterman, Sam Ball, Lothaire Bluteau, Alan Cumming",5 wins & 4 nominations.,N/A,USA,13 Mar 2001,Jon Shear,Drama,English,73,A tour of The Anger Stage.,https://m.media-amazon.com/images/M/MV5BOTlmZDVhNWUtNTcwNC00ODFmLWJhZTMtMzJjNWRkNjk3NzRmXkEyXkFqcGdeQXVyNjU0NTI0Nw@@._V1_SX300.jpg,Trimark,R,"[{'Source': 'Internet Movie Database', 'Value': '7.0/10'}, {'Source': 'Rotten Tomatoes', 'Value': '72%'}, {'Source': 'Metacritic', 'Value': '73/100'}]",09 Aug 2001,True,103 min,Urbania,movie,N/A,"Daniel Reitz (play), Daniel Reitz (screenplay), Jon Shear (screenplay)",2000,tt0182508,7.0,"2,836",
438,"Yûrei Yanagi, Takako Fuji, Takashi Matsuyama, Ryôta Koyama",N/A,N/A,Japan,10 Oct 2006,Takashi Shimizu,"Horror, Mystery",Japanese,N/A,"On his request, the sensitive sister of a real estate agent visits a house he intends to put on sell, only to cross paths with its resident curse.",https://m.media-amazon.com/images/M/MV5BYzhkOGI0MzUtMjA4NS00ZTRkLThiNDgtNDM1MzhkNzg3YTBkXkEyXkFqcGdeQXVyMTQxNzMzNDI@._V1_SX300.jpg,Lions Gate Releasing,Not Rated,"[{'Source': 'Internet Movie Database', 'Value': '6.2/10'}, {'Source': 'Rotten Tomatoes', 'Value': '56%'}]",01 Apr 2004,True,76 min,Ju-on: The Curse 2,movie,http://www.juonthegrudge.com/,Takashi Shimizu,2000,tt0330501,6.2,"2,599",
439,"Benicio Del Toro, Jacob Vargas, Andrew Chavez, Michael Saucedo",Won 4 Oscars. Another 69 wins & 83 nominations.,"$123,836,420","USA, Germany",29 May 2001,Steven Soderbergh,"Crime, Drama, Thriller","English, Spanish",86,"A conservative judge is appointed by the President to spearhead America's escalating war against drugs, only to discover that his teenage daughter is a crack addict. Two DEA agents protect an informant. A jailed drug baron's wife attempts to carry on the family business.",https://m.media-amazon.com/images/M/MV5BNDA2YjNkMjEtZjcwNy00ZTc5LWEzNDItMjE0ODlmMDAzNDFkXkEyXkFqcGdeQXVyMTMxODk2OTU@._V1_SX300.jpg,USA Films,R,"[{'Source': 'Internet Movie Database', 'Value': '7.6/10'}, {'Source': 'Rotten Tomatoes', 'Value': '92%'}, {'Source': 'Metacritic', 'Value': '86/100'}]",05 Jan 2001,True,147 min,Traffic,movie,http://www.trafficthemovie.com,"Simon Moore (miniseries Traffik), Stephen Gaghan (screenplay)",2000,tt0181865,7.6,"184,901",
440,"Alfre Woodard, Ossie Davis, Max Casella, Hayden Panettiere",4 wins & 21 nominations.,"$135,606,304",USA,30 Jan 2001,"Eric Leighton, Ralph Zondag","Animation, Adventure, Family, Thriller",English,56,An orphaned dinosaur raised by lemurs joins an arduous trek to a sancturary after a meteorite shower destroys his family home.,https://m.media-amazon.com/images/M/MV5BZWQ1NTZjMjUtODNmZS00NTVhLWFhM2ItNWZiOTdjMzdhZTY2XkEyXkFqcGdeQXVyMTQxNzMzNDI@._V1_SX300.jpg,Buena Vista,PG,"[{'Source': 'Internet Movie Database', 'Value': '6.5/10'}, {'Source': 'Rotten Tomatoes', 'Value': '65%'}, {'Source': 'Metacritic', 'Value': '56/100'}]",19 May 2000,True,82 min,Dinosaur,movie,http://disney.go.com/disneypictures/dinosaur/dinomain.html,"Thom Enriquez (story), John Harrison (story), Robert Nelson Jacobs (story), Ralph Zondag (story), John Harrison (screenplay), Robert Nelson Jacobs (screenplay), Walon Green (based on an earlier screenplay by), Gregory Gunter (creative development), Shirley Pierce (screenplay), Jonathan Roberts (additional story material), Rhett Reese (additional story material), Tamara Lusher Stocker (additional story)",2000,tt0130623,6.5,"46,973",
441,"Meg Ryan, Diane Keaton, Lisa Kudrow, Walter Matthau",2 wins & 1 nomination.,N/A,"Germany, USA",27 Jun 2000,Diane Keaton,"Comedy, Drama",English,33,"A trio of sisters bond over their ambivalence toward the approaching death of their curmudgeonly father, to whom none of them was particularly close.",https://m.media-amazon.com/images/M/MV5BNzJjYjgwZjMtYThhZi00NzNlLWI0Y2YtZjkxYWNlYWI2ZDJkXkEyXkFqcGdeQXVyMTQxNzMzNDI@._V1_SX300.jpg,Sony Pictures Home Entertainment,PG-13,"[{'Source': 'Internet Movie Database', 'Value': '4.8/10'}, {'Source': 'Rotten Tomatoes', 'Value': '12%'}, {'Source': 'Metacritic', 'Value': '33/100'}]",18 Feb 2000,True,94 min,Hanging Up,movie,http://www.spe.sony.com/movies/hangingup/index.html,"Delia Ephron (book), Delia Ephron (screenplay), Nora Ephron (screenplay)",2000,tt0162983,4.8,"11,219",
442,"Leslie Nielsen, Steven Eckholdt, Robyn Lively, Max Morrow",3 nominations.,N/A,USA,06 Nov 2001,William Dear,"Comedy, Fantasy",English,N/A,Santa suffers a case of amnesia on the eve of his busiest season.,https://images-na.ssl-images-amazon.com/images/M/MV5BMTkxMDY0ODU1NV5BMl5BanBnXkFtZTcwNjAyMjMyMQ@@._V1_SX300.jpg,Hearst Entertainment &amp; Syndication,N/A,"[{'Source': 'Internet Movie Database', 'Value': '5.2/10'}]",19 Nov 2000,True,92 min,Santa Who?,movie,N/A,"Debra Frank (teleplay), Steve L. Hayes (teleplay), Chad Hoffman (unpublished story), Robert Schwartz (unpublished story)",2000,tt0251382,5.2,"1,386",
443,"Benicio Del Toro, Dennis Farina, Vinnie Jones, Brad Pitt",4 wins & 6 nominations.,"$30,093,107","UK, USA",03 Jul 2001,Guy Ritchie,"Comedy, Crime","English, Russian",55,"Unscrupulous boxing promoters, violent bookmakers, a Russian gangster, incompetent amateur robbers and supposedly Jewish jewelers fight to track down a priceless stolen diamond.",https://m.media-amazon.com/images/M/MV5BMTA2NDYxOGYtYjU1Mi00Y2QzLTgxMTQtMWI1MGI0ZGQ5MmU4XkEyXkFqcGdeQXVyNDk3NzU2MTQ@._V1_SX300.jpg,Columbia Pictures,R,"[{'Source': 'Internet Movie Database', 'Value': '8.3/10'}, {'Source': 'Rotten Tomatoes', 'Value': '73%'}, {'Source': 'Metacritic', 'Value': '55/100'}]",19 Jan 2001,True,102 min,Snatch,movie,N/A,Guy Ritchie,2000,tt0208092,8.3,"708,496",
444,"Michelle Pfeiffer, Katharine Towne, Miranda Otto, James Remar",5 wins & 5 nominations.,"$155,018,556",USA,30 Jan 2001,Robert Zemeckis,"Drama, Fantasy, Horror, Mystery, Thriller",English,51,The wife of a university research scientist believes that her lakeside Vermont home is haunted by a ghost - or that she is losing her mind.,https://m.media-amazon.com/images/M/MV5BNTY4NjNkMTMtNTEyOC00NDBiLWFkZjMtZDkwYzU3OTFjOTkzXkEyXkFqcGdeQXVyNTUyMzE4Mzg@._V1_SX300.jpg,DreamWorks SKG,PG-13,"[{'Source': 'Internet Movie Database', 'Value': '6.6/10'}, {'Source': 'Rotten Tomatoes', 'Value': '46%'}, {'Source': 'Metacritic', 'Value': '51/100'}]",21 Jul 2000,True,130 min,What Lies Beneath,movie,N/A,"Clark Gregg (screenplay), Sarah Kernochan (story), Clark Gregg (story)",2000,tt0161081,6.6,"109,545",
445,"Søren Pilmark, Ulrich Thomsen, Mads Mikkelsen, Nikolaj Lie Kaas",3 wins & 11 nominations.,N/A,"Denmark, Sweden",25 Mar 2003,Anders Thomas Jensen,"Action, Comedy, Crime",Danish,47,"Four small-time gangsters from Copenhagen trick a gangster boss: they take over 4,000,000 kroner which they were supposed to bring him. Trying to escape to Barcelona they are forced to stop...",https://m.media-amazon.com/images/M/MV5BNDY5NzgyMDYwMl5BMl5BanBnXkFtZTcwODE5MjYxMQ@@._V1_SX300.jpg,Vanguard,Not Rated,"[{'Source': 'Internet Movie Database', 'Value': '7.7/10'}, {'Source': 'Rotten Tomatoes', 'Value': '70%'}, {'Source': 'Metacritic', 'Value': '47/100'}]",03 Nov 2000,True,109 min,Flickering Lights,movie,N/A,Anders Thomas Jensen (screenplay),2000,tt0236027,7.7,"17,340",
446,"Carmen Maura, Eduardo Antuña, María Asquerino, Jesús Bonilla",20 wins & 17 nominations.,N/A,Spain,11 Jan 2005,Álex de la Iglesia,"Comedy, Crime, Horror, Mystery, Thriller",Spanish,N/A,"The accidental discovery of a big fortune hidden in the apartment of a deceased man will fill the heart of a real estate agent with greed and dreams of a luxurious life, but the neighbours think otherwise.",https://m.media-amazon.com/images/M/MV5BOGRmOTVjYWEtZTA2OS00ZmM5LTg2MmMtZThhNmIxNTkxODQ4XkEyXkFqcGdeQXVyMTA0MjU0Ng@@._V1_SX300.jpg,Lolafilms Distribucion,R,"[{'Source': 'Internet Movie Database', 'Value': '7.3/10'}]",29 Sep 2000,True,110 min,Common Wealth,movie,N/A,"Jorge Guerricaechevarría, Álex de la Iglesia",2000,tt0255067,7.3,"9,820",
447,"Charlotte Ayanna, Kristin Bauer van Straten, W. Earl Brown, Daryl Hannah",2 wins & 1 nomination.,N/A,USA,25 Dec 2001,Michael Radford,"Drama, Mystery","English, Russian",41,A non-glamorous portrayal of the lives of people who make their living at a strip club.,https://m.media-amazon.com/images/M/MV5BOTc3MTE1MTMxNl5BMl5BanBnXkFtZTcwMDMwMTMzMQ@@._V1_SX300.jpg,Keystone Entertainment,R,"[{'Source': 'Internet Movie Database', 'Value': '5.8/10'}, {'Source': 'Rotten Tomatoes', 'Value': '23%'}, {'Source': 'Metacritic', 'Value': '41/100'}]",11 Oct 2001,True,123 min,Dancing at the Blue Iguana,movie,http://www.iguana-movie.com,"Michael Radford (screenplay), David Linter (screenplay)",2000,tt0217355,5.8,"3,436",
448,"Cameron Diaz, Drew Barrymore, Lucy Liu, Bill Murray",14 wins & 30 nominations.,"$124,420,707","USA, Germany",11 Dec 2001,McG,"Action, Adventure, Comedy, Crime, Thriller","English, German, Finnish, Japanese, Cantonese",52,"Three women, detectives with a mysterious boss, retrieve stolen voice-ID software, using martial arts, tech skills, and sex appeal.",https://m.media-amazon.com/images/M/MV5BMGI1NTM5MTItNDcxMS00YTIwLTg1NjUtNzE5ZGE5NDkxMmU4XkEyXkFqcGdeQXVyMTQxNzMzNDI@._V1_SX300.jpg,Columbia Pictures,PG-13,"[{'Source': 'Internet Movie Database', 'Value': '5.5/10'}, {'Source': 'Rotten Tomatoes', 'Value': '68%'}, {'Source': 'Metacritic', 'Value': '52/100'}]",03 Nov 2000,True,98 min,Charlie's Angels,movie,http://www.spe.sony.com/movies/jump/charliesangels.html,"Ryan Rowe, Ed Solomon, John August, Ivan Goff (TV series), Ben Roberts (TV series)",2000,tt0160127,5.5,"161,866",
449,"Nicolas Cage, Giovanni Ribisi, Angelina Jolie, T.J. Cross",9 wins & 6 nominations.,"$100,978,700",USA,05 Dec 2000,Dominic Sena,"Action, Crime, Thriller",English,35,A retired master car thief must come back to the industry and steal fifty cars with his crew in one night to save his brother's life.,https://m.media-amazon.com/images/M/MV5BMTIwMzExNDEwN15BMl5BanBnXkFtZTYwODMxMzg2._V1_SX300.jpg,Buena Vista Pictures,PG-13,"[{'Source': 'Internet Movie Database', 'Value': '6.5/10'}, {'Source': 'Rotten Tomatoes', 'Value': '25%'}, {'Source': 'Metacritic', 'Value': '35/100'}]",09 Jun 2000,True,118 min,Gone in 60 Seconds,movie,http://studio.go.com/movies/goneinsixty,"H.B. Halicki, Scott Rosenberg (screenplay)",2000,tt0187078,6.5,"243,614",
450,"Russell Crowe, Joaquin Phoenix, Connie Nielsen, Oliver Reed",Won 5 Oscars. Another 53 wins & 101 nominations.,N/A,"USA, UK",21 Nov 2000,Ridley Scott,"Action, Adventure, Drama",English,67,A former Roman General sets out to exact vengeance against the corrupt emperor who murdered his family and sent him into slavery.,https://m.media-amazon.com/images/M/MV5BMDliMmNhNDEtODUyOS00MjNlLTgxODEtN2U3NzIxMGVkZTA1L2ltYWdlXkEyXkFqcGdeQXVyNjU0OTQ0OTY@._V1_SX300.jpg,Dreamworks Distribution LLC,R,"[{'Source': 'Internet Movie Database', 'Value': '8.5/10'}, {'Source': 'Rotten Tomatoes', 'Value': '76%'}, {'Source': 'Metacritic', 'Value': '67/100'}]",05 May 2000,True,155 min,Gladiator,movie,http://www.gladiator-thefilm.com,"David Franzoni (story), David Franzoni (screenplay), John Logan (screenplay), William Nicholson (screenplay)",2000,tt0172495,8.5,"1,196,241",
451,"Jamie Bell, Jean Heywood, Jamie Draven, Gary Lewis",Nominated for 3 Oscars. Another 54 wins & 65 nominations.,N/A,"UK, France",17 Apr 2001,Stephen Daldry,"Drama, Music, Romance",English,74,A talented young boy becomes torn between his unexpected love of dance and the disintegration of his family.,https://m.media-amazon.com/images/M/MV5BNGY3NWYwNzctNWU5Yi00ZjljLTgyNDgtZjNhZjRlNjc0ZTU1XkEyXkFqcGdeQXVyMTQxNzMzNDI@._V1_SX300.jpg,NCM Fathom,R,"[{'Source': 'Internet Movie Database', 'Value': '7.7/10'}, {'Source': 'Rotten Tomatoes', 'Value': '85%'}, {'Source': 'Metacritic', 'Value': '74/100'}]",10 Nov 2000,True,110 min,Billy Elliot,movie,N/A,Lee Hall,2000,tt0249462,7.7,"113,834",
452,"Hugh Jackman, Patrick Stewart, Ian McKellen, Famke Janssen",13 wins & 26 nominations.,"$156,164,829",USA,21 Nov 2000,Bryan Singer,"Action, Adventure, Sci-Fi",English,64,"In a world where mutants (evolved super-powered humans) exist and are discriminated against, two groups form for an inevitable clash: the supremacist Brotherhood, and the pacifist X-Men.",https://m.media-amazon.com/images/M/MV5BZmIyMDk5NGYtYjQ5NS00ZWQxLTg2YzQtZDk1ZmM4ZDBlN2E3XkEyXkFqcGdeQXVyMTQxNzMzNDI@._V1_SX300.jpg,20th Century Fox,PG-13,"[{'Source': 'Internet Movie Database', 'Value': '7.4/10'}, {'Source': 'Rotten Tomatoes', 'Value': '81%'}, {'Source': 'Metacritic', 'Value': '64/100'}]",14 Jul 2000,True,104 min,X-Men,movie,http://www.x-men-the-movie.com,"Tom DeSanto (story), Bryan Singer (story), David Hayter (screenplay)",2000,tt0120903,7.4,"529,406",
453,"Janet McTeer, Michael Davis, Michael Goodwin, Gregory Russell Cook",5 wins & 5 nominations.,"$1,634,064",USA,23 Oct 2001,Maggie Greenwald,"Drama, Music",English,63,"After being denied a promotion at the university where she teaches, Doctor Lily Penleric, a brilliant musicologist, impulsively visits her sister, who runs a struggling rural school in ...",https://m.media-amazon.com/images/M/MV5BMTYwODg2OTUyNV5BMl5BanBnXkFtZTcwMjY2NTc0MQ@@._V1_SX300.jpg,Lions Gate,PG-13,"[{'Source': 'Internet Movie Database', 'Value': '7.2/10'}, {'Source': 'Rotten Tomatoes', 'Value': '74%'}, {'Source': 'Metacritic', 'Value': '63/100'}]",27 Jul 2001,True,109 min,Songcatcher,movie,http://www.songcatcherthefilm.com,Maggie Greenwald,2000,tt0210299,7.2,"3,032",
454,"Clive Owen, Helen Mirren, David Kelly, Warren Clarke",1 nomination.,N/A,"UK, USA",02 Jan 2002,Joel Hershman,"Comedy, Crime, Romance",English,46,A prison inmate with a green thumb goes on to compete in a national gardening competition. Based on a true story.,https://m.media-amazon.com/images/M/MV5BMTA3NjA2MzU5MTReQTJeQWpwZ15BbWU3MDA1MjkzMjE@._V1_SX300.jpg,IDP Distribution,R,"[{'Source': 'Internet Movie Database', 'Value': '6.9/10'}, {'Source': 'Rotten Tomatoes', 'Value': '46%'}, {'Source': 'Metacritic', 'Value': '46/100'}]",14 Sep 2001,True,91 min,Greenfingers,movie,http://www.greenfingersmovie.com,Joel Hershman,2000,tt0203540,6.9,"5,192",
455,"Jackie Chan, Owen Wilson, Lucy Liu, Brandon Merrill",1 win & 7 nominations.,N/A,"USA, Hong Kong",10 Oct 2000,Tom Dey,"Action, Adventure, Comedy, Western","English, Mandarin, Sioux, Spanish",77,"A Chinese man travels to the Wild West to rescue a kidnapped Princess. After teaming up with a train robber, the unlikely duo takes on a Chinese traitor and his corrupt boss.",https://m.media-amazon.com/images/M/MV5BMTI0MjE2MzUwOV5BMl5BanBnXkFtZTYwMTk5NjU3._V1_SX300.jpg,Buena Vista Internationa,PG-13,"[{'Source': 'Internet Movie Database', 'Value': '6.6/10'}, {'Source': 'Rotten Tomatoes', 'Value': '79%'}, {'Source': 'Metacritic', 'Value': '77/100'}]",26 May 2000,True,110 min,Shanghai Noon,movie,http://studio.go.com/movies/shanghainoon/index.html,"Miles Millar, Alfred Gough",2000,tt0184894,6.6,"110,547",
456,"Ashton Kutcher, Seann William Scott, Jennifer Garner, Marla Sokoloff",5 nominations.,"$44,992,961",USA,26 Jun 2001,Danny Leiner,"Comedy, Mystery, Sci-Fi","English, Japanese, French",30,Two potheads wake up after a night of partying and cannot remember where they parked their car.,https://m.media-amazon.com/images/M/MV5BNzRmN2NjNzktOWE1My00NjVlLWFhNjYtZmFkMzM5YTA2ZTFlXkEyXkFqcGdeQXVyMTQxNzMzNDI@._V1_SX300.jpg,20th Century Fox,PG-13,"[{'Source': 'Internet Movie Database', 'Value': '5.5/10'}, {'Source': 'Rotten Tomatoes', 'Value': '18%'}, {'Source': 'Metacritic', 'Value': '30/100'}]",15 Dec 2000,True,83 min,"Dude, Where's My Car?",movie,http://www.dudewheresmycar.com,Philip Stark,2000,tt0242423,5.5,"127,709",
457,"Naomi Fujiyama, Etsushi Toyokawa, Michiyo Ohkusu, Riho Makise",24 wins & 6 nominations.,N/A,Japan,N/A,Junji Sakamoto,"Comedy, Crime, Drama",Japanese,N/A,N/A,https://images-na.ssl-images-amazon.com/images/M/MV5BMjAyMTY4MjQyN15BMl5BanBnXkFtZTcwMzk0MzEzMQ@@._V1_SX300.jpg,N/A,N/A,"[{'Source': 'Internet Movie Database', 'Value': '6.9/10'}]",12 Aug 2000,True,124 min,Face,movie,N/A,"Junji Sakamoto, Isamu Uno (screenplay), Isamu Uno (story)",2000,tt0256127,6.9,314,
458,"Michelle Rodriguez, Jaime Tirelli, Paul Calderon, Douglas Santiago",15 wins & 18 nominations.,"$778,046",USA,27 Mar 2001,Karyn Kusama,"Drama, Sport","English, Spanish",70,"Diana, without her father knowing it, trains as a boxer and achieves impressive success, blazing new trails for female boxers.",https://m.media-amazon.com/images/M/MV5BMjMxMzFiODYtYTA3OC00Mjk0LTk5MzgtZjkxMDRiM2M1MzMyXkEyXkFqcGdeQXVyMTQxNzMzNDI@._V1_SX300.jpg,Screen Gems,R,"[{'Source': 'Internet Movie Database', 'Value': '6.8/10'}, {'Source': 'Metacritic', 'Value': '70/100'}]",06 Oct 2000,True,110 min,Girlfight,movie,http://www.sony.com/girlfight,Karyn Kusama,2000,tt0210075,6.8,"8,854",
459,"Will Friedle, Kevin Conroy, Mark Hamill, Angie Harmon",3 wins & 5 nominations.,N/A,USA,12 Dec 2000,Curt Geda,"Animation, Action, Crime, Sci-Fi, Thriller",English,N/A,"The Joker is back with a vengeance, and Gotham's newest Dark Knight needs answers as he stands alone to face Gotham's most infamous Clown Prince of Crime.",https://m.media-amazon.com/images/M/MV5BNmRmODEwNzctYzU1MS00ZDQ1LWI2NWMtZWFkNTQwNDg1ZDFiXkEyXkFqcGdeQXVyNTI4MjkwNjA@._V1_SX300.jpg,Warner Home Video,PG-13,"[{'Source': 'Internet Movie Database', 'Value': '7.8/10'}, {'Source': 'Rotten Tomatoes', 'Value': '88%'}]",N/A,True,76 min,Batman Beyond: Return of the Joker,movie,N/A,"Bob Kane (character created by: Batman), Paul Dini (story), Glen Murakami (story), Bruce Timm (story), Paul Dini (screenplay)",2000,tt0233298,7.8,"20,658",
460,"Billy Crudup, Frances McDormand, Kate Hudson, Jason Lee",Won 1 Oscar. Another 52 wins & 103 nominations.,"$31,716,715",USA,13 Mar 2001,Cameron Crowe,"Adventure, Comedy, Drama, Music","English, French",90,A high-school boy is given the chance to write a story for Rolling Stone Magazine about an up-and-coming rock band as he accompanies them on their concert tour.,https://m.media-amazon.com/images/M/MV5BMzY1ZjMwMGEtYTY1ZS00ZDllLTk0ZmUtYzA3ZTA4NmYwNGNkXkEyXkFqcGdeQXVyNDk3NzU2MTQ@._V1_SX300.jpg,DreamWorks SKG,R,"[{'Source': 'Internet Movie Database', 'Value': '7.9/10'}, {'Source': 'Rotten Tomatoes', 'Value': '89%'}, {'Source': 'Metacritic', 'Value': '90/100'}]",22 Sep 2000,True,122 min,Almost Famous,movie,http://www.almost-famous.com,Cameron Crowe,2000,tt0181875,7.9,"233,430",
461,"Glenndon Chatman, Jess Willard, Chris Warren, Kyla Pratt",12 wins & 15 nominations.,N/A,USA,10 Oct 2000,Gina Prince-Bythewood,"Drama, Romance, Sport","English, Spanish",70,Monica and Quincy love and play basketball together through many life challenges from childhood to adulthood.,https://m.media-amazon.com/images/M/MV5BMTU4NjY4NTI5MF5BMl5BanBnXkFtZTYwNjQ4OTc3._V1_SX300.jpg,New Line Cinema,PG-13,"[{'Source': 'Internet Movie Database', 'Value': '7.2/10'}, {'Source': 'Rotten Tomatoes', 'Value': '82%'}, {'Source': 'Metacritic', 'Value': '70/100'}]",21 Apr 2000,True,124 min,Love & Basketball,movie,http://www.loveandbasketball.com,Gina Prince-Bythewood,2000,tt0199725,7.2,"16,572",
462,"Louisa Elder, George Thomas Jr., Meg Kannin, Shawn Douglass",1 win.,N/A,USA,N/A,George Thomas Jr.,"Comedy, Romance",English,N/A,N/A,http://ia.media-imdb.com/images/M/MV5BMTI1MDg4MDQzN15BMl5BanBnXkFtZTcwOTMxMDgyMQ@@._V1_SX300.jpg,N/A,N/A,"[{'Source': 'Internet Movie Database', 'Value': '6.7/10'}]",16 Dec 2000,True,79 min,Something Between Us,movie,N/A,George Thomas Jr.,2000,tt0286137,6.7,13,
463,"Craig Sheffer, Nicholas Turturro, James Remar, Doug Bradley",1 win & 2 nominations.,N/A,USA,10 Oct 2000,Scott Derrickson,"Crime, Horror, Mystery, Thriller",English,N/A,"A shady police detective becomes embroiled in a strange world of murder, sadism and madness after being assigned a murder investigation against a madman known only as ""The Engineer"".",https://m.media-amazon.com/images/M/MV5BZTJkYzI4ZGQtYTU3Yy00MWU1LWE3NjUtZjI5Zjc2ZGI0Mjc5XkEyXkFqcGdeQXVyMTQxNzMzNDI@._V1_SX300.jpg,Miramax,R,"[{'Source': 'Internet Movie Database', 'Value': '5.6/10'}]",03 Oct 2000,True,99 min,Hellraiser: Inferno,movie,http://www.miramax.com/movie/hellraiser-v-inferno/,"Clive Barker (characters), Paul Harris Boardman, Scott Derrickson",2000,tt0229440,5.6,"13,454",
464,"George Clooney, John Turturro, Tim Blake Nelson, John Goodman",Nominated for 2 Oscars. Another 7 wins & 35 nominations.,"$45,150,731","UK, France, USA",12 Jun 2001,"Joel Coen, Ethan Coen","Adventure, Comedy, Crime, Music",English,69,"In the deep south during the 1930s, three escaped convicts search for hidden treasure while a relentless lawman pursues them.",https://m.media-amazon.com/images/M/MV5BMjZkOTdmMWItOTkyNy00MDdjLTlhNTQtYzU3MzdhZjA0ZDEyXkEyXkFqcGdeQXVyMTMxODk2OTU@._V1_SX300.jpg,Buena Vista,PG-13,"[{'Source': 'Internet Movie Database', 'Value': '7.8/10'}, {'Source': 'Rotten Tomatoes', 'Value': '77%'}, {'Source': 'Metacritic', 'Value': '69/100'}]",02 Feb 2001,True,107 min,"O Brother, Where Art Thou?",movie,http://studio.go.com/movies/obrother/index.html,"Homer (epic poem ""The Odyssey""), Ethan Coen, Joel Coen",2000,tt0190590,7.8,"262,469",
465,"Devon Sawa, Ali Larter, Kerr Smith, Kristen Cloke",3 wins & 3 nominations.,N/A,USA,26 Sep 2000,James Wong,"Horror, Thriller","English, French",36,"After a teenager has a terrifying vision of him and his friends dying in a plane crash, he prevents the accident only to have Death hunt them down, one by one.",https://m.media-amazon.com/images/M/MV5BZTI0NGM2OGYtNzVmMi00NGQ2LTk2MDAtN2RmYjIzMGRkZGYxXkEyXkFqcGdeQXVyNTAyODkwOQ@@._V1_SX300.jpg,New Line Cinema,R,"[{'Source': 'Internet Movie Database', 'Value': '6.7/10'}, {'Source': 'Rotten Tomatoes', 'Value': '34%'}, {'Source': 'Metacritic', 'Value': '36/100'}]",17 Mar 2000,True,98 min,Final Destination,movie,http://www.deathiscoming.com,"Glen Morgan (screenplay), James Wong (screenplay), Jeffrey Reddick (screenplay), Jeffrey Reddick (story)",2000,tt0195714,6.7,"208,669",
466,"Monica Bellucci, Giuseppe Sulfaro, Luciano Federico, Matilde Piana",Nominated for 2 Oscars. Another 7 wins & 17 nominations.,N/A,"Italy, USA",10 Jul 2001,Giuseppe Tornatore,"Comedy, Drama, Romance, War","Italian, English, Latin, Greek,  Ancient (to 1453)",54,"Amidst the war climate, a teenage boy discovering himself becomes love-stricken by Malèna, a sensual woman living in a small, narrow-minded Italian town.",https://m.media-amazon.com/images/M/MV5BZGViM2E0MjktZTdlNy00Y2M0LThlN2UtZThkZGNlMWIyMmY1XkEyXkFqcGdeQXVyNjQ2MjQ5NzM@._V1_SX300.jpg,Miramax,R,"[{'Source': 'Internet Movie Database', 'Value': '7.5/10'}, {'Source': 'Rotten Tomatoes', 'Value': '54%'}, {'Source': 'Metacritic', 'Value': '54/100'}]",02 Feb 2001,True,108 min,Malèna,movie,http://www.miramax.com/mm_front/owa/mp.entryPoint?action=0&amp;midStr=1375,"Giuseppe Tornatore (screenplay), Luciano Vincenzoni (original story)",2000,tt0213847,7.5,"78,734",
467,"Adam Sandler, Patricia Arquette, Harvey Keitel, Rhys Ifans",1 win & 12 nominations.,"$38,542,597",USA,24 Apr 2001,Steven Brill,"Comedy, Fantasy",English,38,"After two of the devil's three sons escape Hell to wreak havoc on Earth, the devil must send his third son, the mild-mannered Nicky, to bring them back before it's too late.",https://m.media-amazon.com/images/M/MV5BMTQ4MTk3Mzk5NV5BMl5BanBnXkFtZTYwMTQ3NzI3._V1_SX300.jpg,New Line Cinema,PG-13,"[{'Source': 'Internet Movie Database', 'Value': '5.3/10'}, {'Source': 'Rotten Tomatoes', 'Value': '22%'}, {'Source': 'Metacritic', 'Value': '38/100'}]",10 Nov 2000,True,90 min,Little Nicky,movie,http://www.littlenicky.com,"Tim Herlihy, Adam Sandler, Steven Brill",2000,tt0185431,5.3,"90,609",
468,"Glenn Fitzgerald, Anson Mount, Bob Burrus, Julianne Nicholson",5 wins & 6 nominations.,N/A,USA,17 Jun 2003,Hilary Birmingham,Drama,English,73,"Tully Coates, Jr., with his good looks and chiseled body, is the local heartthrob, and while he has a new girlfriend virtually every night, he's incapable of getting close to anyone. His ...",https://images-na.ssl-images-amazon.com/images/M/MV5BNTMyMDE5ODI5M15BMl5BanBnXkFtZTcwMzQ0MjAwMQ@@._V1_SX300.jpg,Small Planet,R,"[{'Source': 'Internet Movie Database', 'Value': '7.4/10'}, {'Source': 'Rotten Tomatoes', 'Value': '81%'}, {'Source': 'Metacritic', 'Value': '73/100'}]",14 Apr 2000,True,102 min,Tully,movie,http://www.tullythemovie.com,"Hilary Birmingham, Matt Drake, Tom McNeal (story)",2000,tt0212604,7.4,"1,750",
