,Actors,Awards,BoxOffice,Country,DVD,Director,Genre,Language,Metascore,Plot,Poster,Production,Rated,Ratings,Released,Response,Runtime,Title,Type,Website,Writer,Year,imdbID,imdbRating,imdbVotes,totalSeasons
203,"Franka Potente, Moritz Bleibtreu, Herbert Knaup, Nina Petri",Nominated for 1 BAFTA Film Award. Another 28 wins & 19 nominations.,N/A,Germany,21 Dec 1999,Tom Tykwer,"Crime, Drama, Thriller","German, English, Japanese",77,"After a botched money delivery, Lola has 20 minutes to come up with 100,000 Deutschmarks.",https://m.media-amazon.com/images/M/MV5BMmU5ZjFmYjQtYmNjZC00Yjk4LWI1ZTQtZDJiMjM0YjQyNDU0L2ltYWdlL2ltYWdlXkEyXkFqcGdeQXVyMTQxNzMzNDI@._V1_SX300.jpg,Sony Pictures Classics,R,"[{'Source': 'Internet Movie Database', 'Value': '7.7/10'}, {'Source': 'Rotten Tomatoes', 'Value': '93%'}, {'Source': 'Metacritic', 'Value': '77/100'}]",18 Jun 1999,True,80 min,Run Lola Run,movie,N/A,Tom Tykwer (screenplay),1998,tt0130827,7.7,"178,094",
204,"Edward Norton, Edward Furlong, Beverly D'Angelo, Jennifer Lien",Nominated for 1 Oscar. Another 4 wins & 13 nominations.,N/A,USA,06 Apr 1999,Tony Kaye,"Crime, Drama",English,62,A former neo-nazi skinhead tries to prevent his younger brother from going down the same wrong path that he did.,https://m.media-amazon.com/images/M/MV5BZjA0MTM4MTQtNzY5MC00NzY3LWI1ZTgtYzcxMjkyMzU4MDZiXkEyXkFqcGdeQXVyNDYyMDk5MTU@._V1_SX300.jpg,New Line Cinema,R,"[{'Source': 'Internet Movie Database', 'Value': '8.5/10'}, {'Source': 'Rotten Tomatoes', 'Value': '83%'}, {'Source': 'Metacritic', 'Value': '62/100'}]",20 Nov 1998,True,119 min,American History X,movie,https://www.warnerbros.com/american-history-x,David McKenna,1998,tt0120586,8.5,"939,520",
205,"Sean Penn, Kevin Spacey, Robin Wright, Chazz Palminteri",1 win & 3 nominations.,N/A,USA,22 Jun 1999,Anthony Drazan,"Comedy, Drama",English,N/A,Hollywood movers and shakers dissect their own personal lives when everything seems to clash together.,https://m.media-amazon.com/images/M/MV5BZjk5OTIyNDQtNzQ1Mi00NDM5LWIwMGUtN2Y0MzNiZGQ4NDhlXkEyXkFqcGdeQXVyMTQxNzMzNDI@._V1_SX300.jpg,New Line Home Entertainment,R,"[{'Source': 'Internet Movie Database', 'Value': '5.8/10'}, {'Source': 'Rotten Tomatoes', 'Value': '58%'}]",25 Dec 1998,True,122 min,Hurlyburly,movie,N/A,"David Rabe (play), David Rabe (screenplay)",1998,tt0119336,5.8,"9,479",
206,"George Clooney, Jennifer Lopez, Jim Robinson, Mike Malone",Nominated for 2 Oscars. Another 13 wins & 12 nominations.,N/A,USA,04 May 1999,Steven Soderbergh,"Crime, Drama, Romance, Thriller",English,85,"A career bank robber breaks out of jail, and shares a moment of mutual attraction with a U.S. Marshal he has kidnapped.",https://m.media-amazon.com/images/M/MV5BMjA0MjMwNTE4Nl5BMl5BanBnXkFtZTgwNjExNzQxMTE@._V1_SX300.jpg,Universal Pictures,R,"[{'Source': 'Internet Movie Database', 'Value': '7.0/10'}, {'Source': 'Rotten Tomatoes', 'Value': '93%'}, {'Source': 'Metacritic', 'Value': '85/100'}]",26 Jun 1998,True,123 min,Out of Sight,movie,N/A,"Elmore Leonard (novel), Scott Frank (screenplay)",1998,tt0120780,7.0,"79,090",
207,"Julia Roberts, Susan Sarandon, Ed Harris, Jena Malone",Nominated for 1 Golden Globe. Another 8 wins & 6 nominations.,N/A,USA,22 May 2001,Chris Columbus,"Comedy, Drama",English,58,"A terminally ill woman has to settle on her former husband's new lover, who will be their children's stepmother.",https://m.media-amazon.com/images/M/MV5BMGJlOWM3ODctZjY3NC00YmRjLTg0NjgtNTFhOWQ4YzI4YjU3L2ltYWdlL2ltYWdlXkEyXkFqcGdeQXVyMTQxNzMzNDI@._V1_SX300.jpg,TriStar Pictures,PG-13,"[{'Source': 'Internet Movie Database', 'Value': '6.7/10'}, {'Source': 'Rotten Tomatoes', 'Value': '44%'}, {'Source': 'Metacritic', 'Value': '58/100'}]",25 Dec 1998,True,125 min,Stepmom,movie,http://www.spe.sony.com/movies/stepmom/index.html,"Gigi Levangie (story), Gigi Levangie (screenplay), Jessie Nelson (screenplay), Steven Rogers (screenplay), Karen Leigh Hopkins (screenplay), Ronald Bass (screenplay)",1998,tt0120686,6.7,"55,156",
208,"Jeff Bridges, John Goodman, Julianne Moore, Steve Buscemi",4 wins & 17 nominations.,N/A,"USA, UK",27 Oct 1998,"Joel Coen, Ethan Coen","Comedy, Crime","English, German, Hebrew, Spanish",71,"Jeff ""The Dude"" Lebowski, mistaken for a millionaire of the same name, seeks restitution for his ruined rug and enlists his bowling buddies to help get it.",https://m.media-amazon.com/images/M/MV5BMTQ0NjUzMDMyOF5BMl5BanBnXkFtZTgwODA1OTU0MDE@._V1_SX300.jpg,Gramercy Pictures,R,"[{'Source': 'Internet Movie Database', 'Value': '8.1/10'}, {'Source': 'Rotten Tomatoes', 'Value': '82%'}, {'Source': 'Metacritic', 'Value': '71/100'}]",06 Mar 1998,True,117 min,The Big Lebowski,movie,N/A,"Ethan Coen, Joel Coen",1998,tt0118715,8.1,"653,692",
209,"Kôichi Satô, Miki Nakatani, Hinako Saeki, Shingo Tsurumi",N/A,N/A,Japan,23 Aug 2005,Jôji Iida,"Drama, Fantasy, Horror, Mystery, Thriller",Japanese,N/A,"A young pathologist seeks answers to the mysterious death of a friend and soon comes into contact with the same cursed videotape that caused the death of the friend's wife and son, which is haunted by the curse of Sadako, a relentless spirit.",https://m.media-amazon.com/images/M/MV5BMWIzMTg2ZjYtNGYyNi00OWRjLWFmNjMtYjhiYmQ1ZmJjMGUzXkEyXkFqcGdeQXVyMTQxNzMzNDI@._V1_SX300.jpg,N/A,Not Rated,"[{'Source': 'Internet Movie Database', 'Value': '5.3/10'}]",31 Jan 1998,True,97 min,Rasen,movie,N/A,"Jôji Iida (screenplay), Kôji Suzuki (novel)",1998,tt0134928,5.3,"2,472",
210,"Gerard McSorley, Meryl Streep, Michael Gambon, Catherine McCormack",2 wins & 7 nominations.,N/A,"Ireland, UK, USA",15 Jun 1999,Pat O'Connor,"Drama, Romance",English,N/A,Five unmarried sisters make the most of their simple existence in rural Ireland in the 1930s.,https://images-na.ssl-images-amazon.com/images/M/MV5BMTQ5NzQ3ODEzNl5BMl5BanBnXkFtZTYwODU2MDc5._V1_SX300.jpg,Sony Pictures Classics,PG,"[{'Source': 'Internet Movie Database', 'Value': '6.3/10'}, {'Source': 'Rotten Tomatoes', 'Value': '66%'}]",13 Nov 1998,True,95 min,Dancing at Lughnasa,movie,N/A,"Brian Friel (play), Frank McGuinness (screenplay), William Butler Yeats (poem)",1998,tt0120643,6.3,"3,044",
211,"Thierry Lhermitte, Jacques Villeret, Francis Huster, Daniel Prévost",5 wins & 4 nominations.,N/A,France,25 Apr 2000,Francis Veber,Comedy,French,73,"To amuse themselves at a weekly dinner, a few well-heeled folk each bring a dimwit along who is to talk about his pastime. Each member seeks to introduce a champion dumbbell. Pierre, an ...",https://m.media-amazon.com/images/M/MV5BZjFkOWM5NDUtODYwOS00ZDg0LWFkZGUtYzBkYzNjZjU3ODE3XkEyXkFqcGdeQXVyNzQzNzQxNzI@._V1_SX300.jpg,Lions Gate Films Inc.,PG-13,"[{'Source': 'Internet Movie Database', 'Value': '7.7/10'}, {'Source': 'Rotten Tomatoes', 'Value': '73%'}, {'Source': 'Metacritic', 'Value': '73/100'}]",15 Apr 1998,True,80 min,Le Dîner de Cons,movie,N/A,Francis Veber,1998,tt0119038,7.7,"33,570",
212,"Sam Rockwell, Steve Zahn, Michael Lerner, Paul Giamatti",N/A,N/A,USA,15 Aug 2006,John Hamburg,"Comedy, Crime",English,N/A,"Two untalented singers are mistaken for a pair of major league safe crackers in Providence, Rhode Island. The two are pressed into service by the local hoodlums and quickly find themselves ...",https://m.media-amazon.com/images/M/MV5BMTc0MDcxNTc5NF5BMl5BanBnXkFtZTYwMDg4Mjg5._V1_SX300.jpg,Universal Pictures,R,"[{'Source': 'Internet Movie Database', 'Value': '6.0/10'}, {'Source': 'Rotten Tomatoes', 'Value': '57%'}]",07 Aug 1998,True,88 min,Safe Men,movie,N/A,John Hamburg,1998,tt0120813,6.0,"2,965",
213,"James Marsden, Katie Holmes, Tobias Mehler, Nick Stahl",1 win & 1 nomination.,N/A,"Australia, USA, Canada",14 Aug 2001,David Nutter,"Horror, Mystery, Sci-Fi, Thriller",English,N/A,"The new kid in Cradle Bay, Washington stumbles across something sinister about the town's method of transforming its unruly teens into upstanding citizens.",https://m.media-amazon.com/images/M/MV5BNjcxNGQ2MTktZGI0OC00YTA3LWFlMWUtYzA5NDM5Y2E5NzU3XkEyXkFqcGdeQXVyMTQxNzMzNDI@._V1_SX300.jpg,MGM Home Entertainment,R,"[{'Source': 'Internet Movie Database', 'Value': '5.6/10'}, {'Source': 'Rotten Tomatoes', 'Value': '34%'}]",24 Jul 1998,True,84 min,Disturbing Behavior,movie,N/A,Scott Rosenberg,1998,tt0134619,5.6,"19,252",
214,"Scott Innes, Billy West, Mary Kay Bergman, Frank Welker",2 nominations.,N/A,USA,06 Mar 2001,"Hiroshi Aoyama, Kazumi Fukushima, Jim Stenstrum","Animation, Adventure, Comedy, Family, Fantasy, Mystery",English,N/A,"The Mystery Gang reunite and visit Moonscar Island, a remote island with a dark secret. Daphne wants more than just a villain in a costume, and they get more than they ever expected.",https://m.media-amazon.com/images/M/MV5BNzA1ZmMyYjUtMjMzOS00NGRmLTkzMzQtZmVmN2ExMWI1NjJiXkEyXkFqcGdeQXVyNjg1MDQzMzc@._V1_SX300.jpg,WARNER BROTHERS PICTURES,TV-G,"[{'Source': 'Internet Movie Database', 'Value': '7.8/10'}, {'Source': 'Rotten Tomatoes', 'Value': '86%'}]",22 Sep 1998,True,77 min,Scooby-Doo on Zombie Island,movie,N/A,"Davis Doi (story), Glenn Leopold (story), Glenn Leopold (screenplay), William Hanna (characters), Joseph Barbera (characters)",1998,tt0166792,7.8,"9,096",
215,"Doudou Gueye Thiaw, Maimouna N'Diaye, Awa Sene Sarr, Robert Liensol",11 wins & 1 nomination.,N/A,"France, Belgium, Luxembourg",24 May 2005,"Michel Ocelot, Raymond Burlet","Animation, Adventure, Family, Fantasy",French,N/A,"In a troubled African village, an unusual baby is born.",https://m.media-amazon.com/images/M/MV5BM2MxNGRhZjctZmVkYy00ZGE4LTg5MjctY2I1NGMyYjJjNTMwXkEyXkFqcGdeQXVyNjk1Njg5NTA@._V1_SX300.jpg,Gebeka,N/A,"[{'Source': 'Internet Movie Database', 'Value': '7.6/10'}, {'Source': 'Rotten Tomatoes', 'Value': '96%'}]",27 Oct 2000,True,71 min,Kirikou and the Sorceress,movie,N/A,N/A,1998,tt0181627,7.6,"7,365",
216,"Edward Furlong, Christina Ricci, Bess Armstrong, Mark Joy",2 wins & 1 nomination.,N/A,USA,23 Feb 1999,John Waters,"Comedy, Drama",English,66,"A talented young photographer, who enjoys snapping photos of his satirical, perverted Baltimore neighborhood and his wacky family, gets dragged into a world of pretentious artists from New York City and finds newfound fame.",https://m.media-amazon.com/images/M/MV5BZjVmMWE3ZWMtMzg0NC00YmM0LWIyMTEtZDBmYTA0MTQyZjFkXkEyXkFqcGdeQXVyMTQxNzMzNDI@._V1_SX300.jpg,Fine Line Features,R,"[{'Source': 'Internet Movie Database', 'Value': '6.4/10'}, {'Source': 'Rotten Tomatoes', 'Value': '51%'}, {'Source': 'Metacritic', 'Value': '66/100'}]",09 Oct 1998,True,87 min,Pecker,movie,N/A,John Waters,1998,tt0126604,6.4,"12,646",
217,"Brad Pitt, Anthony Hopkins, Claire Forlani, Jake Weber",3 wins & 6 nominations.,N/A,USA,06 Apr 1999,Martin Brest,"Drama, Fantasy, Romance","English, Dutch",43,"Death, who takes the form of a young man, asks a media mogul to act as a guide to teach him about life on Earth, and in the process, he falls in love with his guide's daughter.",https://m.media-amazon.com/images/M/MV5BNTc0MzRmMTgtMTk4OS00MzdkLWJjNWMtZWJmZjlkYTI0YWRiL2ltYWdlL2ltYWdlXkEyXkFqcGdeQXVyMTQxNzMzNDI@._V1_SX300.jpg,Universal Pictures,PG-13,"[{'Source': 'Internet Movie Database', 'Value': '7.2/10'}, {'Source': 'Rotten Tomatoes', 'Value': '51%'}, {'Source': 'Metacritic', 'Value': '43/100'}]",13 Nov 1998,True,178 min,Meet Joe Black,movie,N/A,"Ron Osborn (screenplay), Jeff Reno (screenplay), Kevin Wade (screenplay), Bo Goldman (screenplay), Alberto Casella (play), Walter Ferris (play), Maxwell Anderson (earlier screenplay), Gladys Lehman (earlier screenplay)",1998,tt0119643,7.2,"193,213",
218,"Thomas Jane, Aaron Eckhart, Paulina Porizkova, James Le Gros",1 win & 1 nomination.,N/A,USA,14 May 2002,Skip Woods,"Action, Comedy, Crime, Drama, Mystery, Thriller",English,N/A,"The movie opens in a Los Angeles convenience store one late Monday night, where a smalltime drug dealer named Nick (Aaron Eckhart) is trying to decide what coffee brand to buy. His ex-lover...",https://m.media-amazon.com/images/M/MV5BMTkyNzExNTg1OV5BMl5BanBnXkFtZTcwMzQwNTgzMQ@@._V1_SX300.jpg,Universal Pictures,R,"[{'Source': 'Internet Movie Database', 'Value': '7.2/10'}, {'Source': 'Rotten Tomatoes', 'Value': '33%'}]",25 Sep 1998,True,87 min,Thursday,movie,N/A,Skip Woods,1998,tt0124901,7.2,"15,917",
219,"Adam Beach, Evan Adams, Irene Bedard, Gary Farmer",11 wins & 8 nominations.,N/A,"Canada, USA",27 Jul 1999,Chris Eyre,"Comedy, Drama",English,76,"Young Indian man Thomas is a nerd in his reservation, wearing oversize glasses and telling everyone stories no-one wants to hear. His parents died in a fire in 1976, and Thomas was saved by...",https://m.media-amazon.com/images/M/MV5BMjA4MjU1NTg0NF5BMl5BanBnXkFtZTgwODYwMDQ1MjE@._V1_SX300.jpg,Miramax Films,PG-13,"[{'Source': 'Internet Movie Database', 'Value': '7.2/10'}, {'Source': 'Rotten Tomatoes', 'Value': '83%'}, {'Source': 'Metacritic', 'Value': '76/100'}]",27 Nov 1998,True,89 min,Smoke Signals,movie,N/A,"Sherman Alexie (book), Sherman Alexie (screenplay)",1998,tt0120321,7.2,"9,008",
220,"David Duchovny, Gillian Anderson, John Neville, William B. Davis",6 wins & 10 nominations.,N/A,USA,04 May 1999,Rob Bowman,"Drama, Mystery, Sci-Fi, Thriller","English, Arabic",60,Mulder and Scully must fight the government in a conspiracy and find the truth about an alien colonization of Earth.,https://m.media-amazon.com/images/M/MV5BZDhkYTM1MmEtNTFhMC00NDEyLWI1MGQtMTkzMTcwMmM3ZTkzXkEyXkFqcGdeQXVyNDk3NzU2MTQ@._V1_SX300.jpg,Twentieth Century Fox Home Entertainment,PG-13,"[{'Source': 'Internet Movie Database', 'Value': '7.0/10'}, {'Source': 'Rotten Tomatoes', 'Value': '65%'}, {'Source': 'Metacritic', 'Value': '60/100'}]",19 Jun 1998,True,121 min,The X Files,movie,N/A,"Chris Carter (story), Frank Spotnitz (story), Chris Carter (screenplay)",1998,tt0120902,7.0,"94,922",
221,"Ben Silverstone, Brad Gorton, Charlotte Brittain, Stacy Hart",6 wins & 3 nominations.,N/A,UK,22 Feb 2000,Simon Shore,"Comedy, Drama, Romance",English,N/A,A tenderly romantic coming-of-age story as two boys in a British school fall in love.,https://m.media-amazon.com/images/M/MV5BODU4ZDVkOTUtYzgwOC00N2ViLWFjNjMtZTI0MTM5ZjAwNjU2XkEyXkFqcGdeQXVyNTM3MDMyMDQ@._V1_SX300.jpg,Paramount Pictures,R,"[{'Source': 'Internet Movie Database', 'Value': '7.6/10'}, {'Source': 'Rotten Tomatoes', 'Value': '79%'}]",30 Apr 1999,True,108 min,Get Real,movie,N/A,"Patrick Wilde (play), Patrick Wilde (screenplay)",1998,tt0162973,7.6,"11,527",
222,"Robin Williams, Daniel London, Monica Potter, Philip Seymour Hoffman",Nominated for 1 Oscar. Another 1 win & 7 nominations.,N/A,USA,22 Jun 1999,Tom Shadyac,"Biography, Comedy, Drama, Romance",English,25,"The true story of a heroic man, Hunter ""Patch"" Adams, determined to become a medical doctor because he enjoys helping people. He ventured where no doctor had ventured before, using humour and pathos.",https://m.media-amazon.com/images/M/MV5BNzM4Y2FlNzYtZmY5Yy00NzU4LTk1ODItY2NjYWYzYzUyZGM3L2ltYWdlXkEyXkFqcGdeQXVyMTQxNzMzNDI@._V1_SX300.jpg,Universal Studios,PG-13,"[{'Source': 'Internet Movie Database', 'Value': '6.7/10'}, {'Source': 'Rotten Tomatoes', 'Value': '23%'}, {'Source': 'Metacritic', 'Value': '25/100'}]",25 Dec 1998,True,115 min,Patch Adams,movie,http://www.patchadams.com,"Patch Adams (book), Maureen Mylander (book), Steve Oedekerk (screenplay)",1998,tt0129290,6.7,"93,565",
223,"José María de Tavira, Diego Sieres, Emiliano Guerra, Yolanda Orizaga",Nominated for 2 Oscars. Another 8 wins & 16 nominations.,N/A,"USA, Germany, Mexico",01 Dec 1998,Martin Campbell,"Action, Adventure, Comedy, Romance, Thriller, Western",English,63,"A young thief, seeking revenge for the death of his brother, is trained by the once great, but aged Zorro, who also pursues vengeance of his own.",https://m.media-amazon.com/images/M/MV5BMzg4ZjQ4OGUtZjkxMi00Y2I2LWEzNTAtODI2ZjkxMGVjNTQwXkEyXkFqcGdeQXVyNjgxNTAwNjQ@._V1_SX300.jpg,Sony Pictures Entertainment,PG-13,"[{'Source': 'Internet Movie Database', 'Value': '6.7/10'}, {'Source': 'Rotten Tomatoes', 'Value': '82%'}, {'Source': 'Metacritic', 'Value': '63/100'}]",17 Jul 1998,True,136 min,The Mask of Zorro,movie,N/A,"Johnston McCulley (character Zorro), Ted Elliott (story), Terry Rossio (story), Randall Jahnson (story), John Eskow (screenplay), Ted Elliott (screenplay), Terry Rossio (screenplay)",1998,tt0120746,6.7,"155,186",
224,"Val Kilmer, Ralph Fiennes, Michelle Pfeiffer, Sandra Bullock",Won 1 Oscar. Another 9 wins & 28 nominations.,N/A,USA,14 Sep 1999,"Brenda Chapman, Steve Hickner, Simon Wells","Animation, Adventure, Drama, Family, Fantasy, Musical","English, Hebrew",64,An Egyptian prince learns of his identity as a Hebrew and his destiny to become the chosen deliverer of his people.,https://m.media-amazon.com/images/M/MV5BOWNjMjgyNmMtNWMzZC00YjI4LWI1NmUtMTY0ZTA0ZDQ4Y2EwXkEyXkFqcGdeQXVyNTUyMzE4Mzg@._V1_SX300.jpg,Dreamworks,PG,"[{'Source': 'Internet Movie Database', 'Value': '7.1/10'}, {'Source': 'Rotten Tomatoes', 'Value': '79%'}, {'Source': 'Metacritic', 'Value': '64/100'}]",18 Dec 1998,True,99 min,The Prince of Egypt,movie,http://www.prince-of-egypt.com,"Philip LaZebnik, Nicholas Meyer (additional screenplay material)",1998,tt0120794,7.1,"106,892",
225,"Vincent Gallo, Christina Ricci, Ben Gazzara, Mickey Rourke",6 wins & 11 nominations.,"$2,365,931","USA, Canada",01 Feb 2000,Vincent Gallo,"Comedy, Crime, Drama, Romance",English,68,"After being released from prison, Billy is set to visit his parents with his wife, whom he does not actually have. This provokes Billy to act out, as he kidnaps a girl and forces her to act as his wife for the visit.",https://m.media-amazon.com/images/M/MV5BMWJkZDFhOTEtMzc5NS00ZmZjLWJmZDItODAzNzgxZjM4NWFlXkEyXkFqcGdeQXVyMTQxNzMzNDI@._V1_SX300.jpg,Lions Gate,R,"[{'Source': 'Internet Movie Database', 'Value': '7.5/10'}, {'Source': 'Rotten Tomatoes', 'Value': '76%'}, {'Source': 'Metacritic', 'Value': '68/100'}]",26 Jun 1998,True,110 min,Buffalo '66,movie,N/A,"Vincent Gallo (original story), Vincent Gallo (screenplay), Alison Bagnall (screenplay)",1998,tt0118789,7.5,"42,333",
226,"Arata Iura, Erika Oda, Susumu Terajima, Takashi Naitô",7 wins & 8 nominations.,N/A,Japan,15 Aug 2000,Hirokazu Koreeda,"Drama, Fantasy",Japanese,91,"After death, people have just one week to choose only a memory to keep for eternity.",https://m.media-amazon.com/images/M/MV5BMTQ4MTg3OTIwMF5BMl5BanBnXkFtZTcwMjg1MDIyMQ@@._V1_SX300.jpg,Artistic License,R,"[{'Source': 'Internet Movie Database', 'Value': '7.7/10'}, {'Source': 'Rotten Tomatoes', 'Value': '86%'}, {'Source': 'Metacritic', 'Value': '91/100'}]",17 Apr 1999,True,118 min,After Life,movie,N/A,Hirokazu Koreeda,1998,tt0165078,7.7,"8,576",
227,"Jason Schwartzman, Bill Murray, Olivia Williams, Seymour Cassel",Nominated for 1 Golden Globe. Another 16 wins & 15 nominations.,N/A,USA,29 Jun 1999,Wes Anderson,"Comedy, Drama","English, Spanish, Latin, French",86,The extracurricular king of Rushmore Preparatory School is put on academic probation.,https://m.media-amazon.com/images/M/MV5BMjE2OTc3OTk2M15BMl5BanBnXkFtZTgwMjg2NjIyMDE@._V1_SX300.jpg,Touchstone Pictures,R,"[{'Source': 'Internet Movie Database', 'Value': '7.7/10'}, {'Source': 'Rotten Tomatoes', 'Value': '89%'}, {'Source': 'Metacritic', 'Value': '86/100'}]",19 Feb 1999,True,93 min,Rushmore,movie,N/A,"Wes Anderson, Owen Wilson",1998,tt0128445,7.7,"155,426",
228,"Wesley Snipes, Stephen Dorff, Kris Kristofferson, N'Bushe Wright",4 wins & 8 nominations.,N/A,USA,22 Dec 1998,Stephen Norrington,"Action, Horror, Sci-Fi","English, Russian, Serbian",45,"A half-vampire, half-mortal man becomes a protector of the mortal race, while slaying evil vampires.",https://m.media-amazon.com/images/M/MV5BMTQ4MzkzNjcxNV5BMl5BanBnXkFtZTcwNzk4NTU0Mg@@._V1_SX300.jpg,New Line Cinema,R,"[{'Source': 'Internet Movie Database', 'Value': '7.1/10'}, {'Source': 'Rotten Tomatoes', 'Value': '53%'}, {'Source': 'Metacritic', 'Value': '45/100'}]",21 Aug 1998,True,120 min,Blade,movie,N/A,David S. Goyer,1998,tt0120611,7.1,"223,771",
229,"Bruce Willis, Billy Bob Thornton, Ben Affleck, Liv Tyler",Nominated for 4 Oscars. Another 15 wins & 35 nominations.,N/A,USA,05 Jan 1999,Michael Bay,"Action, Adventure, Sci-Fi, Thriller","English, Russian, Indonesian",42,"After discovering that an asteroid the size of Texas is going to impact Earth in less than a month, N.A.S.A. recruits a misfit team of deep core drillers to save the planet.",https://m.media-amazon.com/images/M/MV5BMGM0NzE2YjgtZGQ4YS00MmY3LTg4ZDMtYjUwNTNiNTJhNTQ5XkEyXkFqcGdeQXVyMTQxNzMzNDI@._V1_SX300.jpg,Buena Vista,PG-13,"[{'Source': 'Internet Movie Database', 'Value': '6.7/10'}, {'Source': 'Rotten Tomatoes', 'Value': '38%'}, {'Source': 'Metacritic', 'Value': '42/100'}]",01 Jul 1998,True,151 min,Armageddon,movie,N/A,"Jonathan Hensleigh (screenplay), J.J. Abrams (screenplay), Tony Gilroy (adaptation), Shane Salerno (adaptation), Robert Roy Pool (story), Jonathan Hensleigh (story)",1998,tt0120591,6.7,"367,076",
230,"David Cross, Jay Mohr, Alexandra Wilson, Denis Leary",3 wins & 4 nominations.,N/A,USA,01 Dec 1998,Joe Dante,"Action, Adventure, Comedy, Family, Sci-Fi",English,N/A,"When missile technology is used to enhance toy action figures, the toys soon begin to take their battle programming too seriously.",https://m.media-amazon.com/images/M/MV5BNzhiZmZkYjQtMTFlZi00YmQ2LTg5NGEtM2M4ZTg4ZjAyNzI1L2ltYWdlL2ltYWdlXkEyXkFqcGdeQXVyMTQxNzMzNDI@._V1_SX300.jpg,Dreamworks,PG-13,"[{'Source': 'Internet Movie Database', 'Value': '6.1/10'}, {'Source': 'Rotten Tomatoes', 'Value': '48%'}]",10 Jul 1998,True,110 min,Small Soldiers,movie,N/A,"Gavin Scott, Adam Rifkin, Ted Elliott, Terry Rossio",1998,tt0122718,6.1,"85,490",
231,"Tom Hanks, Meg Ryan, Greg Kinnear, Parker Posey",Nominated for 1 Golden Globe. Another 5 wins & 7 nominations.,N/A,USA,04 May 1999,Nora Ephron,"Comedy, Drama, Romance",English,57,Two business rivals who despise each other in real life unwittingly fall in love over the Internet.,https://m.media-amazon.com/images/M/MV5BZTcxNzgzZjMtYzZiZC00MmE1LTg3MzQtZDAxMTYyZWE4MDNhL2ltYWdlXkEyXkFqcGdeQXVyMTQxNzMzNDI@._V1_SX300.jpg,Warner Bros. Pictures,PG,"[{'Source': 'Internet Movie Database', 'Value': '6.6/10'}, {'Source': 'Rotten Tomatoes', 'Value': '68%'}, {'Source': 'Metacritic', 'Value': '57/100'}]",18 Dec 1998,True,119 min,You've Got Mail,movie,http://www.youvegotmail.com,"Miklós László (play), Nora Ephron (screenplay), Delia Ephron (screenplay)",1998,tt0128853,6.6,"175,886",
232,"Dave Foley, Kevin Spacey, Julia Louis-Dreyfus, Hayden Panettiere",Nominated for 1 Oscar. Another 14 wins & 20 nominations.,N/A,USA,20 Apr 1999,"John Lasseter, Andrew Stanton(co-director)","Animation, Adventure, Comedy, Family, Fantasy",English,77,"A misfit ant, looking for ""warriors"" to save his colony from greedy grasshoppers, recruits a group of bugs that turn out to be an inept circus troupe.",https://m.media-amazon.com/images/M/MV5BNThmZGY4NzgtMTM4OC00NzNkLWEwNmEtMjdhMGY5YTc1NDE4XkEyXkFqcGdeQXVyMTQxNzMzNDI@._V1_SX300.jpg,Buena Vista Pictures,G,"[{'Source': 'Internet Movie Database', 'Value': '7.2/10'}, {'Source': 'Rotten Tomatoes', 'Value': '92%'}, {'Source': 'Metacritic', 'Value': '77/100'}]",25 Nov 1998,True,95 min,A Bug's Life,movie,http://www.abugslife.com,"John Lasseter (original story by), Andrew Stanton (original story by), Joe Ranft (original story by), Andrew Stanton (screenplay by), Don McEnery (screenplay by), Bob Shaw (screenplay by)",1998,tt0120623,7.2,"244,180",
233,"Yada Beener, Emil Pinnock, Calen Johnson, Oprah Winfrey",Nominated for 1 Oscar. Another 3 wins & 23 nominations.,N/A,USA,18 May 1999,Jonathan Demme,"Drama, History, Horror",English,57,"Based on the book by Toni Morrison, in which a slave is visited by the spirit of a mysterious young woman",https://m.media-amazon.com/images/M/MV5BYTZlMDFkYjItMjgxYi00MDNhLTg0NDYtNDY1NzJkNDg0MGQ4XkEyXkFqcGdeQXVyNzc5MjA3OA@@._V1_SX300.jpg,Touchstone Pictures,R,"[{'Source': 'Internet Movie Database', 'Value': '5.9/10'}, {'Source': 'Rotten Tomatoes', 'Value': '78%'}, {'Source': 'Metacritic', 'Value': '57/100'}]",16 Oct 1998,True,172 min,Beloved,movie,http://www.belovedthemovie.com,"Toni Morrison (novel), Akosua Busia (screenplay), Richard LaGravenese (screenplay), Adam Brooks (screenplay)",1998,tt0120603,5.9,"6,541",
234,"Alan Rickman, Polly Walker, Norman Reedus, Janet Mecca",1 nomination.,N/A,USA,21 Aug 2001,Adam Coleman Howard,"Thriller, Drama",English,N/A,"A bickering couple drive fast through a downpour to catch the last ferry to their island retreat. In a flash, they recognize a crumpled body laying at the side of the road after much ...",https://m.media-amazon.com/images/M/MV5BMTUyNjY0NTY0NF5BMl5BanBnXkFtZTcwNzM4NjUxMQ@@._V1_SX300.jpg,Artisan Entertainment,R,"[{'Source': 'Internet Movie Database', 'Value': '6.2/10'}]",31 Dec 1999,True,96 min,Dark Harbor,movie,N/A,"Adam Coleman Howard, Gretchen Hayduk-Wroblewski (script development), Justin Lazard",1998,tt0129023,6.2,"2,203",
235,"Leonardo DiCaprio, Jeremy Irons, John Malkovich, Gérard Depardieu",3 wins & 4 nominations.,N/A,"France, USA",11 Aug 1998,Randall Wallace,"Action, Adventure, Drama","English, Italian",48,The cruel King Louis XIV of France has a secret twin brother who he keeps imprisoned. Can the twin be substituted for the real king?,https://m.media-amazon.com/images/M/MV5BZjM2YzcxMmQtOTc2Mi00YjdhLWFlZjUtNmFmMDQzYzU2YTk5L2ltYWdlXkEyXkFqcGdeQXVyNTAyODkwOQ@@._V1_SX300.jpg,MGM Home Entertainment,PG-13,"[{'Source': 'Internet Movie Database', 'Value': '6.5/10'}, {'Source': 'Rotten Tomatoes', 'Value': '33%'}, {'Source': 'Metacritic', 'Value': '48/100'}]",13 Mar 1998,True,132 min,The Man in the Iron Mask,movie,N/A,"Alexandre Dumas (novels), Randall Wallace (screenplay)",1998,tt0120744,6.5,"144,664",
