,Actors,Awards,BoxOffice,Country,DVD,Director,Genre,Language,Metascore,Plot,Poster,Production,Rated,Ratings,Released,Response,Runtime,Title,Type,Website,Writer,Year,imdbID,imdbRating,imdbVotes,totalSeasons
671,"Aamir Khan, Gracy Singh, Rachel Shelley, Paul Blackthorne",Nominated for 1 Oscar. Another 44 wins & 19 nominations.,N/A,India,22 Jan 2002,Ashutosh Gowariker,"Adventure, Drama, Musical, Sport","Hindi, English, Awadhi, Urdu",84,The people of a small village in Victorian India stake their future on a game of cricket against their ruthless British rulers.,https://m.media-amazon.com/images/M/MV5BNDYxNWUzZmYtOGQxMC00MTdkLTkxOTctYzkyOGIwNWQxZjhmXkEyXkFqcGdeQXVyNjU0OTQ0OTY@._V1_SX300.jpg,B4U Entertainment,PG,"[{'Source': 'Internet Movie Database', 'Value': '8.1/10'}, {'Source': 'Rotten Tomatoes', 'Value': '95%'}, {'Source': 'Metacritic', 'Value': '84/100'}]",15 Jun 2001,True,224 min,Lagaan: Once Upon a Time in India,movie,http://www.lagaan.com,"Ashutosh Gowariker (story), Ashutosh Gowariker (screenplay), Kumar Dave (screenplay), Sanjay Dayma (screenplay), K.P. Saxena (dialogue)",2001,tt0169102,8.1,"91,686",
672,"Miki Sakai, Satoshi Tsumabuki, Kumiko Endô, Masaya Kikawada",N/A,N/A,Japan,25 May 2004,Takashi Shimizu,Horror,Japanese,N/A,"An art student disappears after murdering his model. Now his friends and family are being haunted by the resurrected woman, Tomie.",https://images-na.ssl-images-amazon.com/images/M/MV5BZTIzZmRiZTgtMTA3ZS00MWY4LWEwMTItZTVmOTY1YjI1ZGU2XkEyXkFqcGdeQXVyMTIxMDUyOTI@._V1_SX300.jpg,N/A,N/A,"[{'Source': 'Internet Movie Database', 'Value': '5.6/10'}]",24 Mar 2001,True,101 min,Tomie: Re-birth,movie,N/A,"Yoshinobu Fujioka (screenplay), Junji Ito (Tomie comics)",2001,tt0348225,5.6,443,
673,"Mark Wahlberg, Tim Roth, Helena Bonham Carter, Michael Clarke Duncan",Nominated for 2 BAFTA Film Awards. Another 10 wins & 27 nominations.,"$178,094,583",USA,20 Nov 2001,Tim Burton,"Action, Adventure, Sci-Fi, Thriller",English,50,"In 2029, an Air Force astronaut crash-lands on a mysterious planet where evolved, talking apes dominate a race of primitive humans.",https://m.media-amazon.com/images/M/MV5BY2RlMDhlY2MtMjQ1Zi00NzI5LTgxOTgtZjliNWMzYTY3NWZkL2ltYWdlL2ltYWdlXkEyXkFqcGdeQXVyMTQxNzMzNDI@._V1_SX300.jpg,20th Century Fox,PG-13,"[{'Source': 'Internet Movie Database', 'Value': '5.7/10'}, {'Source': 'Rotten Tomatoes', 'Value': '45%'}, {'Source': 'Metacritic', 'Value': '50/100'}]",27 Jul 2001,True,119 min,Planet of the Apes,movie,http://www.planetoftheapes.com,"Pierre Boulle (novel), William Broyles Jr. (screenplay), Lawrence Konner (screenplay), Mark Rosenthal (screenplay)",2001,tt0133152,5.7,"200,180",
674,"John Tormey, John Schuck, Woody Allen, Elizabeth Berkley",1 win & 1 nomination.,"$6,793,998","USA, Germany",29 Jan 2002,Woody Allen,"Comedy, Crime, Mystery, Romance","English, French",52,An insurance investigator and an efficency expert who hate each other are both hypnotized by a crooked hypnotist with a jade scorpion into stealing jewels.,https://m.media-amazon.com/images/M/MV5BMzViMTNjNGUtMTQyNy00NTRhLWIzODEtYzJkM2YyNTg3YjMwXkEyXkFqcGdeQXVyNDQzMDg4Nzk@._V1_SX300.jpg,Dreamworks,PG-13,"[{'Source': 'Internet Movie Database', 'Value': '6.8/10'}, {'Source': 'Rotten Tomatoes', 'Value': '45%'}, {'Source': 'Metacritic', 'Value': '52/100'}]",24 Aug 2001,True,103 min,The Curse of the Jade Scorpion,movie,http://www.dreamworks.com/jadescorpion,Woody Allen,2001,tt0256524,6.8,"35,552",
675,"Ezra Godden, Francisco Rabal, Raquel Meroño, Macarena Gómez",8 nominations.,N/A,Spain,23 Jul 2002,Stuart Gordon,"Fantasy, Horror, Mystery","English, Gallegan, Spanish",N/A,A boating accident runs a young man and woman ashore in a decrepit Spanish fishing town which they discover is in the grips of an ancient sea god and its monstrous half human offspring.,https://m.media-amazon.com/images/M/MV5BYmZlMTI5MTktNzMxNi00ZmZiLWFiMWItNjc2ODZlYmY0OWVmXkEyXkFqcGdeQXVyMTQxNzMzNDI@._V1_SX300.jpg,LionsGate Entertainment,R,"[{'Source': 'Internet Movie Database', 'Value': '6.3/10'}, {'Source': 'Rotten Tomatoes', 'Value': '64%'}]",31 Oct 2001,True,98 min,Dagon,movie,N/A,"H.P. Lovecraft (short stories ""Dagon"" and ""The Shadow Over Innsmouth""), Dennis Paoli (screenplay)",2001,tt0264508,6.3,"14,867",
676,"Amitabh Bachchan, Jaya Bhaduri, Shah Rukh Khan, Kajol",22 wins & 43 nominations.,N/A,India,02 Sep 2003,Karan Johar,"Drama, Musical, Romance","Hindi, English",N/A,"After marrying a poor woman, rich Rahul is disowned by his father and moves to London to build a new life. Years later, his now grown up little brother Rohan embarks on a mission to bring Rahul back home and reunite the family again.",https://m.media-amazon.com/images/M/MV5BZjc5NGExODktNjE3MC00OGJiLWE1NzItNzI1MzU5ODBjNWVkXkEyXkFqcGdeQXVyODE5NzE3OTE@._V1_SX300.jpg,Dharma Productions,Not Rated,"[{'Source': 'Internet Movie Database', 'Value': '7.5/10'}, {'Source': 'Rotten Tomatoes', 'Value': '100%'}]",14 Dec 2001,True,210 min,Kabhi Khushi Kabhie Gham...,movie,N/A,"Karan Johar, Sheena Parikh (screenplay)",2001,tt0248126,7.5,"39,392",
677,"Robert De Niro, Edward Norton, Marlon Brando, Angela Bassett",1 win & 1 nomination.,"$70,307,038","USA, Germany, Canada",11 Dec 2001,Frank Oz,"Crime, Drama, Thriller","English, French",71,An aging thief hopes to retire and live off his ill-gotten wealth when a young kid convinces him into doing one last heist.,https://m.media-amazon.com/images/M/MV5BZDNjYmY1ZDEtM2I3YS00MDhmLTk5NDYtYzU5MTA4ZjIyYzJiL2ltYWdlL2ltYWdlXkEyXkFqcGdeQXVyMTQxNzMzNDI@._V1_SX300.jpg,Paramount Pictures,R,"[{'Source': 'Internet Movie Database', 'Value': '6.8/10'}, {'Source': 'Rotten Tomatoes', 'Value': '73%'}, {'Source': 'Metacritic', 'Value': '71/100'}]",13 Jul 2001,True,124 min,The Score,movie,http://www.thescoremovie.com,"Daniel E. Taylor (story), Kario Salem (story), Kario Salem (screenplay), Lem Dobbs (screenplay), Scott Marshall Smith (screenplay)",2001,tt0227445,6.8,"112,438",
678,"Brad Pitt, Julia Roberts, James Gandolfini, J.K. Simmons",3 wins & 1 nomination.,"$66,588,591","USA, Mexico",07 Aug 2001,Gore Verbinski,"Adventure, Comedy, Crime, Romance","English, Spanish",43,"A man tries to transport an ancient gun called The Mexican, believed to carry a curse, back across the border, while his girlfriend pressures him to give up his criminal ways.",https://m.media-amazon.com/images/M/MV5BNWIxZTExZjctZjA5ZC00NGQ2LTk4M2YtMWIyMGM2NzRlNWVkXkEyXkFqcGdeQXVyMTA0MjU0Ng@@._V1_SX300.jpg,Dreamworks Distribution LLC,R,"[{'Source': 'Internet Movie Database', 'Value': '6.1/10'}, {'Source': 'Rotten Tomatoes', 'Value': '55%'}, {'Source': 'Metacritic', 'Value': '43/100'}]",02 Mar 2001,True,123 min,The Mexican,movie,http://themexican.cannery.com,J.H. Wyman,2001,tt0236493,6.1,"96,403",
679,"Marisa Paredes, Eduardo Noriega, Federico Luppi, Fernando Tielve",6 wins & 7 nominations.,N/A,"Spain, Mexico",25 Jun 2002,Guillermo del Toro,"Drama, Horror",Spanish,78,"After Carlos - a 12-year-old whose father has died in the Spanish Civil War - arrives at an ominous boys' orphanage, he discovers the school is haunted and has many dark secrets that he must uncover.",https://m.media-amazon.com/images/M/MV5BZTI3MDcwZGItZDMwNS00ZDBjLWEwOGEtMWEyMWUxNDlkYzBjL2ltYWdlXkEyXkFqcGdeQXVyNTAyODkwOQ@@._V1_SX300.jpg,Sony Pictures Classics,R,"[{'Source': 'Internet Movie Database', 'Value': '7.5/10'}, {'Source': 'Rotten Tomatoes', 'Value': '92%'}, {'Source': 'Metacritic', 'Value': '78/100'}]",20 Apr 2001,True,106 min,The Devil's Backbone,movie,http://www.sonyclassics.com/devilsbackbone/index.htm,"Guillermo del Toro, Antonio Trashorras, David Muñoz",2001,tt0256009,7.5,"56,358",
680,"Jennifer Westfeldt, Tovah Feldshuh, Esther Wurmfeld, Hillel Friedman",8 wins & 3 nominations.,"$6,960,929",USA,17 Sep 2002,Charles Herman-Wurmfeld,"Comedy, Drama, Romance",English,72,A woman searching for the perfect man instead discovers the perfect woman.,https://m.media-amazon.com/images/M/MV5BMGZkYWY5NzEtZmYwYi00NGMyLWEyZjAtMjQ4NTZjNzQ3NGMzL2ltYWdlL2ltYWdlXkEyXkFqcGdeQXVyMTQxNzMzNDI@._V1_SX300.jpg,Fox Searchlight Pictures,R,"[{'Source': 'Internet Movie Database', 'Value': '6.6/10'}, {'Source': 'Rotten Tomatoes', 'Value': '83%'}, {'Source': 'Metacritic', 'Value': '72/100'}]",05 Apr 2002,True,97 min,Kissing Jessica Stein,movie,http://216.133.243.67,"Heather Juergensen, Jennifer Westfeldt",2001,tt0264761,6.6,"15,207",
681,"Maria Hofstätter, Alfred Mrva, Erich Finsches, Gerti Lehner",7 wins & 3 nominations.,N/A,Austria,13 Apr 2004,Ulrich Seidl,Drama,German,66,"In a suburb of Vienna during some hot summer days: A teacher who is in bondage to a sleazy pimp, a very importunate hitchhiker, a private detective on the run for some car vandals, a couple...",https://m.media-amazon.com/images/M/MV5BMTI5MDY1MzI5MV5BMl5BanBnXkFtZTcwMzQ5MzUyMQ@@._V1_SX300.jpg,Arte France Cinéma,R,"[{'Source': 'Internet Movie Database', 'Value': '7.1/10'}, {'Source': 'Rotten Tomatoes', 'Value': '47%'}, {'Source': 'Metacritic', 'Value': '66/100'}]",09 Nov 2001,True,121 min,Dog Days,movie,N/A,"Veronika Franz, Ulrich Seidl",2001,tt0290661,7.1,"5,550",
682,"Trevor Jack Brooks, Lorelei Linklater, Wiley Wiggins, Glover Gill",5 wins & 20 nominations.,"$2,063,729",USA,07 May 2002,Richard Linklater,"Animation, Drama, Fantasy",English,82,A man shuffles through a dream meeting various people and discussing the meanings and purposes of the universe.,https://m.media-amazon.com/images/M/MV5BMWM0ZjY5ZjctODNkZi00Nzk0LWE1ODUtNGM4ZDUyMzUwMGYwXkEyXkFqcGdeQXVyMTQxNzMzNDI@._V1_SX300.jpg,Fox Searchlight,R,"[{'Source': 'Internet Movie Database', 'Value': '7.8/10'}, {'Source': 'Rotten Tomatoes', 'Value': '80%'}, {'Source': 'Metacritic', 'Value': '82/100'}]",07 Mar 2002,True,99 min,Waking Life,movie,http://www.wakinglife.com,Richard Linklater,2001,tt0243017,7.8,"56,595",
683,"Denise Richards, David Boreanaz, Marley Shelton, Jessica Capshaw",1 win.,"$19,755,422",USA,24 Jul 2001,Jamie Blanks,"Horror, Mystery, Thriller",English,18,Five women are stalked by an unknown assailant while preparing for Valentine's Day.,https://m.media-amazon.com/images/M/MV5BZWQxM2JjNTktYWE4Ni00YmZiLWFlNDEtMWYzMmI4N2NhYjk4XkEyXkFqcGdeQXVyMTQxNzMzNDI@._V1_SX300.jpg,Warner Bros. Pictures,R,"[{'Source': 'Internet Movie Database', 'Value': '4.8/10'}, {'Source': 'Rotten Tomatoes', 'Value': '11%'}, {'Source': 'Metacritic', 'Value': '18/100'}]",02 Feb 2001,True,96 min,Valentine,movie,http://valentinemovie.warnerbros.com,"Tom Savage (novel), Donna Powers (screenplay), Wayne Powers (screenplay), Gretchen J. Berg (screenplay), Aaron Harberts (screenplay)",2001,tt0242998,4.8,"22,841",
684,"Joseph Gordon-Levitt, Maggie Baird, Don Cheadle, Blayne Weaver",1 nomination.,N/A,USA,N/A,Jordan Melamed,Drama,English,60,"Lyle Jensen is subject to sudden and violent outbursts, and he is committed to the juvenile wing of the Northwood Mental Institution. Several other youths are there with a variety of ...",https://m.media-amazon.com/images/M/MV5BMjE2OTU4MTY5N15BMl5BanBnXkFtZTYwODA3NTQ3._V1_SX300.jpg,N/A,R,"[{'Source': 'Internet Movie Database', 'Value': '7.4/10'}, {'Source': 'Metacritic', 'Value': '60/100'}]",23 May 2003,True,100 min,Manic,movie,N/A,"Michael Bacall, Blayne Weaver",2001,tt0252684,7.4,"8,837",
685,"M.L. Piyapas Bhirombhakdi, Sarunyu Wongkrachang, Chatchai Plengpanich, Johnny Anfone",N/A,"$277,562",Thailand,25 Nov 2003,Chatrichalerm Yukol,"Action, Adventure, Drama",Thai,58,"During the 16th century, as Thailand contends with both a civil war and Burmese invasion, a beautiful princess rises up to help protect the glory of the Kingdom of Ayothaya. Based on the life of Queen Suriyothai.",https://images-na.ssl-images-amazon.com/images/M/MV5BNDYyNzYxNzUwNV5BMl5BanBnXkFtZTcwODAxNTQyMQ@@._V1_SX300.jpg,Sony Pictures Classics,R,"[{'Source': 'Internet Movie Database', 'Value': '6.6/10'}, {'Source': 'Rotten Tomatoes', 'Value': '51%'}, {'Source': 'Metacritic', 'Value': '58/100'}]",17 Aug 2001,True,142 min,The Legend of Suriyothai,movie,http://www.sonyclassics.com/legend,"Sunait Chutintaranond, Chatrichalerm Yukol (screenplay)",2001,tt0290879,6.6,"1,716",
686,"Adrian Paul, Bokeem Woodbine, Bai Ling, Péter Halász",N/A,N/A,"USA, Hungary",20 Nov 2001,Michael Oblowitz,"Action, Adventure, Horror","English, German",N/A,"In the distant future vampires have come out of the shadows and tried to live among people as a special and peaceful breed. When a series of murders happens, a cop and his vampire colleague...",https://images-na.ssl-images-amazon.com/images/M/MV5BMTc1NTc4ODMxMV5BMl5BanBnXkFtZTcwNDYwMzAzMQ@@._V1_SX300.jpg,N/A,R,"[{'Source': 'Internet Movie Database', 'Value': '4.7/10'}]",19 Jul 2001,True,91 min,The Breed,movie,N/A,"Christos N. Gage, Ruth Fletcher",2001,tt0265104,4.7,"2,385",
687,"Tom Cruise, Penélope Cruz, Cameron Diaz, Kurt Russell",Nominated for 1 Oscar. Another 5 wins & 33 nominations.,N/A,"USA, Spain",21 May 2002,Cameron Crowe,"Fantasy, Mystery, Romance, Sci-Fi, Thriller","English, Spanish",45,A self-indulgent and vain publishing magnate finds his privileged life upended after a vehicular accident with a resentful lover.,https://m.media-amazon.com/images/M/MV5BYzFlMTJjYzUtMWFjYy00NjkyLTg1Y2EtYmZkMjdlOGQ1ZGYwL2ltYWdlXkEyXkFqcGdeQXVyMTQxNzMzNDI@._V1_SX300.jpg,Paramount Pictures,R,"[{'Source': 'Internet Movie Database', 'Value': '6.9/10'}, {'Source': 'Rotten Tomatoes', 'Value': '42%'}, {'Source': 'Metacritic', 'Value': '45/100'}]",14 Dec 2001,True,136 min,Vanilla Sky,movie,http://www.vanillasky.com,"Alejandro Amenábar (film ""Abre Los Ojos""), Mateo Gil (film ""Abre Los Ojos""), Cameron Crowe (screenplay)",2001,tt0259711,6.9,"232,373",
688,"Julie Andrews, Anne Hathaway, Hector Elizondo, Heather Matarazzo",3 wins & 11 nominations.,"$107,785,435",USA,18 Dec 2001,Garry Marshall,"Comedy, Family, Romance","English, Dutch, Italian",52,"Mia Thermopolis has just found out that she is the heir apparent to the throne of Genovia. With her friends Lilly and Michael Moscovitz in tow, she tries to navigate through the rest of her sixteenth year.",https://m.media-amazon.com/images/M/MV5BMzcwYjEwMzEtZTZmMi00ZGFhLWJhZjItMDAzNDVkNjZmM2U5L2ltYWdlL2ltYWdlXkEyXkFqcGdeQXVyMTQxNzMzNDI@._V1_SX300.jpg,Walt Disney Pictures,G,"[{'Source': 'Internet Movie Database', 'Value': '6.3/10'}, {'Source': 'Rotten Tomatoes', 'Value': '47%'}, {'Source': 'Metacritic', 'Value': '52/100'}]",03 Aug 2001,True,111 min,The Princess Diaries,movie,http://disney.go.com/disneypictures/diaries/index.html,"Meg Cabot (novel), Gina Wendkos (screenplay)",2001,tt0247638,6.3,"114,638",
689,"Reese Witherspoon, Luke Wilson, Selma Blair, Matthew Davis",Nominated for 2 Golden Globes. Another 6 wins & 10 nominations.,"$95,001,351",USA,06 Nov 2001,Robert Luketic,"Comedy, Romance",English,59,"Elle Woods, a fashionable sorority queen is dumped by her boyfriend. She decides to follow him to law school, while she is there she figures out that there is more to her than just looks.",https://m.media-amazon.com/images/M/MV5BNTEyNjUwMTkxMV5BMl5BanBnXkFtZTcwNjk0NDk0NA@@._V1_SX300.jpg,MGM,PG-13,"[{'Source': 'Internet Movie Database', 'Value': '6.3/10'}, {'Source': 'Rotten Tomatoes', 'Value': '69%'}, {'Source': 'Metacritic', 'Value': '59/100'}]",13 Jul 2001,True,96 min,Legally Blonde,movie,http://www.mgm.com/legallyblonde,"Amanda Brown (novel), Karen McCullah (screenplay), Kirsten Smith (screenplay)",2001,tt0250494,6.3,"162,187",
690,"Sabine Azéma, André Dussollier, Éric Berger, Hélène Duc",2 nominations.,N/A,France,N/A,Étienne Chatiliez,Comedy,"French, Japanese, Mandarin",N/A,"Tanguy is 28 years old and still living with his parents. They think it's time he moves out. He doesn't, so they hatch a plan...","https://m.media-amazon.com/images/M/MV5BMTU4MzUyOTc0M15BMl5BanBnXkFtZTcwMjM5MzYyMQ@@._V1._CR16,16,290,403_SY132_CR3,0,89,132_AL_.jpg_V1_SX300.jpg",TF1 Films Production,N/A,"[{'Source': 'Internet Movie Database', 'Value': '6.4/10'}]",21 Nov 2001,True,108 min,Tanguy,movie,http://www.1000films.com/tanguy/,"Laurent Chouchan, Étienne Chatiliez, Yolande Zauberman (idea)",2001,tt0274155,6.4,"6,358",
691,"Brendan Fraser, Bridget Fonda, John Turturro, Chris Kattan",3 nominations.,"$4,942,155",USA,10 Jul 2001,Henry Selick,"Animation, Comedy, Fantasy",English,40,"In a coma, a cartoonist finds himself trapped within his own underground creation and must find a way to get back, while racing against his popular but treacherous character, Monkeybone.",https://m.media-amazon.com/images/M/MV5BZjZiODk2MDMtNjI2OS00MTEzLWFlY2UtMzNhODE5MzNlM2Y0L2ltYWdlL2ltYWdlXkEyXkFqcGdeQXVyNTAyODkwOQ@@._V1_SX300.jpg,20th Century Fox,PG-13,"[{'Source': 'Internet Movie Database', 'Value': '4.7/10'}, {'Source': 'Rotten Tomatoes', 'Value': '19%'}, {'Source': 'Metacritic', 'Value': '40/100'}]",23 Feb 2001,True,93 min,Monkeybone,movie,http://www.bitemymonkey.com,"Kaja Blackley (graphic novel ""Dark Town""), Sam Hamm",2001,tt0166276,4.7,"15,727",
692,"Maggie Smith, Michael Gambon, Kristin Scott Thomas, Camilla Rutherford",Won 1 Oscar. Another 31 wins & 73 nominations.,"$41,274,328","UK, USA, Italy",25 Jun 2002,Robert Altman,"Comedy, Drama, Mystery",English,90,The lives of upstairs guests and downstairs servants at a party in 1932 in a country house in England as they investigate a murder involving one of them.,https://m.media-amazon.com/images/M/MV5BYzM4YzlhZGMtYTI2Yi00OTY4LWE0MzctNDFlYTQ3YmFlOTBjXkEyXkFqcGdeQXVyMTMxODk2OTU@._V1_SX300.jpg,USA Films,R,"[{'Source': 'Internet Movie Database', 'Value': '7.3/10'}, {'Source': 'Rotten Tomatoes', 'Value': '86%'}, {'Source': 'Metacritic', 'Value': '90/100'}]",18 Jan 2002,True,131 min,Gosford Park,movie,http://www.gosfordparkmovie.com,"Julian Fellowes, Robert Altman (based upon an idea by), Bob Balaban (based upon an idea by)",2001,tt0280707,7.3,"72,623",
693,"Angelina Jolie, Jon Voight, Iain Glen, Noah Taylor",4 wins & 18 nominations.,"$129,512,407","USA, UK, Japan, Germany",13 Nov 2001,Simon West,"Action, Adventure, Fantasy, Thriller",English,33,Video game adventurer Lara Croft comes to life in a movie where she races against time and villains to recover powerful ancient artifacts.,https://m.media-amazon.com/images/M/MV5BNzMzODVjMWUtYmIxZS00NDlkLTlmNTktNjI5NTdhZjUzYzY1XkEyXkFqcGdeQXVyMTQxNzMzNDI@._V1_SX300.jpg,Paramount Pictures,PG-13,"[{'Source': 'Internet Movie Database', 'Value': '5.8/10'}, {'Source': 'Rotten Tomatoes', 'Value': '20%'}, {'Source': 'Metacritic', 'Value': '33/100'}]",15 Jun 2001,True,100 min,Lara Croft: Tomb Raider,movie,http://www.tombraidermovie.com,"Sara B. Cooper (story), Mike Werb (story), Michael Colleary (story), Simon West (adaptation), Patrick Massett (screenplay), John Zinman (screenplay)",2001,tt0146316,5.8,"183,921",
694,"George Clooney, Cecelia Ann Birt, Paul L. Nolan, Carol Florence",4 wins & 20 nominations.,"$183,349,128",USA,07 May 2002,Steven Soderbergh,"Crime, Thriller","English, Italian, Cantonese",74,Danny Ocean and his eleven accomplices plan to rob three Las Vegas casinos simultaneously.,https://m.media-amazon.com/images/M/MV5BYzVmYzVkMmUtOGRhMi00MTNmLThlMmUtZTljYjlkMjNkMjJkXkEyXkFqcGdeQXVyNDk3NzU2MTQ@._V1_SX300.jpg,Warner Bros. Pictures,PG-13,"[{'Source': 'Internet Movie Database', 'Value': '7.8/10'}, {'Source': 'Rotten Tomatoes', 'Value': '82%'}, {'Source': 'Metacritic', 'Value': '74/100'}]",07 Dec 2001,True,116 min,Ocean's Eleven,movie,http://oceans11.warnerbros.com,"George Clayton Johnson, Jack Golden Russell, Harry Brown, Charles Lederer, Ted Griffin (screenplay)",2001,tt0240772,7.8,"468,188",
695,"Cassandra Peterson, Richard O'Brien, Mary Scheer, Scott Atkinson",1 win.,N/A,USA,01 Oct 2002,Sam Irvin,"Comedy, Horror",English,48,Spooky high jinks abound when Elvira finds herself spending the night in a mysterious castle en route to 1851 Paris.,https://m.media-amazon.com/images/M/MV5BZjk1NTNmMTctMGMxZi00MGJmLWFlMGItM2I0OWQ1OTExMzQ1XkEyXkFqcGdeQXVyNjE5MjUyOTM@._V1_SX300.jpg,The Elvira Movie Company,PG-13,"[{'Source': 'Internet Movie Database', 'Value': '5.9/10'}, {'Source': 'Rotten Tomatoes', 'Value': '75%'}, {'Source': 'Metacritic', 'Value': '48/100'}]",31 Oct 2002,True,90 min,Elvira's Haunted Hills,movie,N/A,"Cassandra Peterson (character), Cassandra Peterson, John Paragon",2001,tt0265171,5.9,"2,538",
696,"Jim Carrey, Bob Balaban, Jeffrey DeMunn, Hal Holbrook",3 wins & 1 nomination.,N/A,USA,18 Jun 2002,Frank Darabont,"Drama, Romance",English,27,"Set in 1951, a blacklisted Hollywood writer gets into a car accident, loses his memory and settles down in a small town where he is mistaken for a long-lost son.",https://m.media-amazon.com/images/M/MV5BOTI2NjkzMTkxM15BMl5BanBnXkFtZTYwMzM2MjA5._V1_SX300.jpg,Universal Pictures,PG,"[{'Source': 'Internet Movie Database', 'Value': '6.9/10'}, {'Source': 'Rotten Tomatoes', 'Value': '42%'}, {'Source': 'Metacritic', 'Value': '27/100'}]",21 Dec 2001,True,152 min,The Majestic,movie,http://movies.warnerbros.com/themajestic,Michael Sloane,2001,tt0268995,6.9,"49,405",
697,"Samuel Le Bihan, Mark Dacascos, Jérémie Renier, Vincent Cassel",4 wins & 22 nominations.,"$10,793,478",France,01 Oct 2002,Christophe Gans,"Action, Adventure, Drama, Horror, Thriller","French, German, Italian",57,"In 18th century France, the Chevalier de Fronsac and his native American friend Mani are sent by the King to the Gevaudan province to investigate the killings of hundreds by a mysterious beast.",https://m.media-amazon.com/images/M/MV5BNTkxMjg5MDYtZDkyMS00NjFlLTk5YTItMWUyOTNkOTg4YmRhXkEyXkFqcGdeQXVyNDk3NzU2MTQ@._V1_SX300.jpg,TVA International,R,"[{'Source': 'Internet Movie Database', 'Value': '7.1/10'}, {'Source': 'Rotten Tomatoes', 'Value': '73%'}, {'Source': 'Metacritic', 'Value': '57/100'}]",01 Feb 2002,True,142 min,Brotherhood of the Wolf,movie,N/A,"Stéphane Cabel (original scenario), Stéphane Cabel (adaptation), Christophe Gans (adaptation)",2001,tt0237534,7.1,"58,241",
698,"Jet Li, Bridget Fonda, Tchéky Karyo, Max Ryan",N/A,"$34,705,149","France, USA",22 Jan 2002,Chris Nahon,"Action, Crime, Drama, Thriller","English, French, Mandarin",58,A betrayed intelligence officer enlists the aid of a prostitute to prove his innocence from a deadly conspiracy while returning a favor to her.,https://m.media-amazon.com/images/M/MV5BYzM0ZDIxNDYtZDJjMy00NTc5LWIyMTgtMzBhNGRiZTU0ZmRjL2ltYWdlL2ltYWdlXkEyXkFqcGdeQXVyMTQxNzMzNDI@._V1_SX300.jpg,20th Century Fox,R,"[{'Source': 'Internet Movie Database', 'Value': '6.6/10'}, {'Source': 'Rotten Tomatoes', 'Value': '51%'}, {'Source': 'Metacritic', 'Value': '58/100'}]",06 Jul 2001,True,98 min,Kiss of the Dragon,movie,http://www.kissofthedragon.com,"Jet Li (story), Luc Besson (screenplay), Robert Mark Kamen (screenplay)",2001,tt0271027,6.6,"57,771",
699,"Emma Thompson, Christopher Lloyd, Eileen Atkins, Audra McDonald",Nominated for 2 Golden Globes. Another 11 wins & 19 nominations.,N/A,USA,11 Sep 2001,Mike Nichols,Drama,English,N/A,A renowned professor is forced to reassess her life when she is diagnosed with terminal ovarian cancer.,https://ia.media-imdb.com/images/M/MV5BMTQyMDgxOTQ0N15BMl5BanBnXkFtZTcwMTUzODgyMQ@@._V1_SX300.jpg,HBO Video,PG-13,"[{'Source': 'Internet Movie Database', 'Value': '8.1/10'}, {'Source': 'Rotten Tomatoes', 'Value': '83%'}]",24 Mar 2001,True,99 min,Wit,movie,N/A,"Margaret Edson (play), Emma Thompson (teleplay), Mike Nichols (teleplay)",2001,tt0243664,8.1,"7,982",
700,"Anthony Michael Hall, Sheryl Lee, Alex Carter, Brenda Devine",N/A,N/A,USA,23 Apr 2002,Wesley Strick,Thriller,English,N/A,"After a homemaker discovers that her husband is a philanderer, she imprisons him in their soundproof basement and reports him missing to the police.",https://ia.media-imdb.com/images/M/MV5BMTY4NzYwMjk5OF5BMl5BanBnXkFtZTcwOTU1NjYxMQ@@._V1_SX300.jpg,USA Films,N/A,"[{'Source': 'Internet Movie Database', 'Value': '5.4/10'}]",18 Sep 2001,True,89 min,Hitched,movie,N/A,Wesley Strick,2001,tt0272127,5.4,303,
701,"John Goodman, Billy Crystal, Mary Gibbs, Steve Buscemi",Won 1 Oscar. Another 13 wins & 38 nominations.,"$34,034,168",USA,19 Feb 2013,"Pete Docter, David Silverman(co-director), Lee Unkrich(co-director)","Animation, Adventure, Comedy, Family, Fantasy",English,78,"In order to power the city, monsters have to scare children so that they scream. However, the children are toxic to the monsters, and after a child gets through, 2 monsters realize things may not be what they think.",https://m.media-amazon.com/images/M/MV5BMTY1NTI0ODUyOF5BMl5BanBnXkFtZTgwNTEyNjQ0MDE@._V1_SX300.jpg,Buena Vista Distribution Compa,G,"[{'Source': 'Internet Movie Database', 'Value': '8.1/10'}, {'Source': 'Rotten Tomatoes', 'Value': '96%'}, {'Source': 'Metacritic', 'Value': '78/100'}]",02 Nov 2001,True,92 min,"Monsters, Inc.",movie,http://disney.go.com/monstersinc/index.html,"Pete Docter (original story by), Jill Culton (original story by), Jeff Pidgeon (original story by), Ralph Eggleston (original story by), Andrew Stanton (screenplay by), Daniel Gerson (screenplay by), Bob Peterson (additional story material), David Silverman (additional story material), Joe Ranft (additional story material), Robert L. Baird (additional screenplay material), Rhett Reese (additional screenplay material), Jonathan Roberts (additional screenplay material)",2001,tt0198781,8.1,"728,088",
702,"Jake Gyllenhaal, Holmes Osborne, Maggie Gyllenhaal, Daveigh Chase",11 wins & 15 nominations.,N/A,USA,19 Mar 2002,Richard Kelly,"Drama, Sci-Fi, Thriller",English,88,"A troubled teenager is plagued by visions of a man in a large rabbit suit who manipulates him to commit a series of crimes, after he narrowly escapes a bizarre accident.",https://m.media-amazon.com/images/M/MV5BZjZlZDlkYTktMmU1My00ZDBiLWFlNjEtYTBhNjVhOTM4ZjJjXkEyXkFqcGdeQXVyMTMxODk2OTU@._V1_SX300.jpg,Newmarket Film Group,R,"[{'Source': 'Internet Movie Database', 'Value': '8.1/10'}, {'Source': 'Rotten Tomatoes', 'Value': '87%'}, {'Source': 'Metacritic', 'Value': '88/100'}]",26 Oct 2001,True,113 min,Donnie Darko,movie,http://www.donniedarko.com,Richard Kelly,2001,tt0246578,8.1,"690,132",
